stockcode,description,category,revenue,qty_sold,orders,avg_price,cancel_rate,revenue_share
84944,Set Of 6 Kashmir Folkart Baubles,Set,3153.88,1135,194,3.86,2.49,0.0154
21519,Gin & Tonic Diet Greeting Card,Gin,3149.93,7356,553,0.5,0.54,0.0154
23035,Drawer Knob Ceramic Ivory,Drawer,3147.79,2155,190,1.65,1.03,0.0154
23323,White Wicker Star,White,3146.78,1469,294,2.25,0.98,0.0154
22313,Office Mug Warmer Pink,Office,3146.07,985,137,4.27,1.42,0.0154
21705,Bag 500G Swirly Marbles,Bag,3145.7099999999996,2534,225,1.81,2.15,0.0154
21239,Pink  Spotty Cup,Pink,3145.4900000000002,3684,369,1.0,1.17,0.0154
21500,Pink Spots  Wrap,Pink,3144.5,7825,232,0.42,0.0,0.0154
22773,Green Drawer Knob Acrylic Edwardian,Green,3141.11,2368,226,1.54,0.43,0.0153
22325,Mobile Vintage Hearts,Mobile,3139.99,699,224,5.01,6.64,0.0153
21820,Glitter Heart Garland With Bells,Glitter,3132.39,795,180,4.69,1.6,0.0153
82578,Kitchen Metal Sign,Kitchen,3129.2400000000002,5595,704,0.71,0.28,0.0153
22095,Lads Only Tissue Box,Lads,3123.0299999999997,2978,284,1.39,2.34,0.0153
23346,Spaceboy Beaker,Spaceboy,3112.34,2628,184,1.52,0.53,0.0152
21352,Eucalyptus & Pinecone  Wreath,Eucalyptus,3110.28,880,158,5.29,2.45,0.0152
21272,Salle De Bain Hook,Salle,3109.83,2348,339,1.64,1.43,0.0152
22406,Money Box Kings Choice Design,Money,3104.35,2451,214,1.47,1.79,0.0152
22891,Tea For One Polkadot,Tea,3103.7,644,230,5.6,9.45,0.0152
22177,5 Hook Blackboard Organiser,5,3101.46,325,125,11.89,7.41,0.0151
22972,Children'S Spaceboy Mug,Children'S,3100.9399999999996,1810,238,2.0,3.17,0.0151
47504K,English Rose Garden Secateurs,English,3096.08,2654,312,1.87,1.55,0.0151
22572,Rocking Horse Green Christmas,Rocking,3087.18,3439,362,1.04,0.27,0.0151
20956,Porcelain T-Light Holders Assorted,Porcelain,3083.82,2338,236,1.76,1.63,0.0151
79072,Teatime Cake Tin With Handle,Teatime,3083.2,284,107,12.71,6.96,0.0151
21707,"Folding Umbrella , Black/Blue  Spot",Folding,3077.01,775,69,5.07,0.0,0.015
84279B,Cherry Blossom Decorative Flask,Cherry,3076.92,808,215,4.3,4.02,0.015
21765,Hanging Metal Bird Bath,Hanging,3076.39,371,143,9.03,1.35,0.015
22347,Pizza Slice Dish,Pizza,3074.18,2680,113,1.67,0.0,0.015
23188,Vintage  2 Meter Folding Ruler,Vintage,3073.72,1844,181,1.88,0.88,0.015
22372,Airline Bag Vintage World Champion,Airline,3073.43,604,287,5.34,1.03,0.015
22154,Angel Decoration 3 Buttons,Angel,3073.32,7114,317,0.53,4.08,0.015
84912B,Green Rose Washbag,Green,3072.64,1125,259,3.51,0.0,0.015
22473,Tv Dinner Tray Vintage Paisley,Tv,3070.92,811,209,5.2,0.0,0.015
22757,Large Red Babushka Notebook,Large,3070.18,2696,308,1.52,0.32,0.015
21206,Strawberry Honeycomb  Garland,Strawberry,3067.8999999999996,2155,238,1.86,1.64,0.015
21537,Red Retrospot Pudding Bowl,Red,3065.45,711,182,4.67,4.71,0.015
22963,Jam Jar With Green Lid,Jam,3060.43,3670,317,1.07,3.59,0.0149
20985,Heart Calculator,Heart,3047.99,2370,291,1.54,1.96,0.0149
84969,Box Of 6 Assorted Colour Teaspoons,Box,3047.91,701,255,4.75,1.45,0.0149
21408,Spotty Pink Duck Doorstop,Spotty,3045.31,703,240,5.91,1.23,0.0149
22754,Small Red Babushka Notebook,Small,3044.8599999999997,3924,492,0.99,0.2,0.0149
23461,Sweetheart Bird House,Sweetheart,3041.21,847,94,4.55,0.99,0.0149
23329,Decorative Wicker Heart Large,Decorative,3038.1899999999996,1767,233,1.77,0.4,0.0148
22208,Wood Stamp Set Thank You,Wood,3036.95,2366,433,1.56,0.68,0.0148
22037,Robot Birthday Card,Robot,3035.7,7054,634,0.52,0.16,0.0148
21588,Retro Spot Giant  Tube Matches,Retro,3034.9500000000003,1295,102,2.52,1.03,0.0148
15044C,Purple Paper Parasol,Purple,3027.26,967,231,3.82,1.69,0.0148
23242,Treasure Tin Buffalo Bill,Treasure,3024.63,1470,214,2.28,1.36,0.0148
23237,Set Of 4 Knick Knack Tins Leaf,Set,3020.61,747,123,4.27,5.35,0.0148
22067,Choc Truffle Gold Trinket Pot,Choc,3019.3199999999997,1855,252,2.1,4.51,0.0147
21626,Vintage Union Jack Pennant,Vintage,3017.0699999999997,1496,204,2.33,5.5,0.0147
22349,"Dog Bowl , Chasing Ball Design",Dog,3014.3,754,136,4.17,2.9,0.0147
22402,Magnets Pack Of 4 Vintage Collage,Magnets,3012.78,3431,250,0.92,1.17,0.0147
22202,Milk Pan Pink Retrospot,Milk,3011.2400000000002,743,184,5.12,4.33,0.0147
22805,Blue Drawer Knob Acrylic Edwardian,Blue,3008.82,2207,231,1.66,0.86,0.0147
23236,Doiley Storage Tin,Doiley,3004.46,1094,122,3.1,4.9,0.0147
22712,Card Dolly Girl,Card,3002.42,7295,508,0.55,0.78,0.0147
22755,Small Purple Babushka Notebook,Small,2997.63,3776,499,0.98,0.2,0.0146
84912A,Pink Rose Washbag,Pink,2996.44,1094,231,3.62,0.0,0.0146
23390,Dolly Girl Mini Backpack,Dolly,2992.3900000000003,739,161,4.39,0.6,0.0146
22132,Red Love Heart Shape Cup,Red,2989.81,3345,388,1.15,0.26,0.0146
22925,Blue Giant Garden Thermometer,Blue,2989.52,488,191,6.48,2.54,0.0146
21507,"Elephant, Birthday Card,","Elephant,",2980.63,7113,489,0.5,0.34,0.0146
21354,Toast Its - Best Mum,Toast,2979.46,2476,217,1.5,0.0,0.0146
22375,Airline Bag Vintage Jet Set Brown,Airline,2969.29,590,284,5.49,0.7,0.0145
22519,Childs Garden Brush Pink,Childs,2968.77,1425,258,2.48,1.14,0.0145
21706,"Folding Umbrella , Red/White Spot",Folding,2962.82,916,104,5.29,1.93,0.0145
22905,Calendar In Season Design,Calendar,2957.17,1077,194,2.96,0.0,0.0144
22674,French Toilet Sign Blue Metal,French,2956.33,2377,297,1.45,0.99,0.0144
22664,Toy Tidy Dolly Girl Design,Toy,2954.19,1429,266,2.76,1.12,0.0144
22816,Card Motorbike Santa,Card,2950.93,6856,436,0.48,0.45,0.0144
22927,Green Giant Garden Thermometer,Green,2948.57,468,162,6.7,4.14,0.0144
23211,Red Rocking Horse Hand Painted,Red,2930.57,2329,160,1.57,0.61,0.0143
22071,Small White Retrospot Mug In Box,Small,2929.75,1147,175,3.83,3.7,0.0143
22277,Cosmetic Bag Vintage Rose Paisley,Cosmetic,2927.4900000000002,1400,250,2.48,0.79,0.0143
85049D,Bright Blues Ribbons,Bright,2922.96,2330,400,1.32,0.0,0.0143
21948,Set Of 6 Cake Chopsticks,Set,2921.36,2293,267,1.88,0.0,0.0143
21214,Set Of 72 Ivory Paper Doilies,Set,2920.8199999999997,2006,199,1.99,0.49,0.0143
22990,Cotton Apron Pantry Design,Cotton,2917.43,633,164,5.32,6.21,0.0142
21592,Retrospot Cigar Box Matches,Retrospot,2900.46,2772,286,1.16,0.2,0.0142
22518,Childs Garden Brush Blue,Childs,2899.8,1398,266,2.55,0.0,0.0142
23290,Spaceboy Childrens Bowl,Spaceboy,2890.3500000000004,2430,214,1.44,0.93,0.0141
22184,Cake Stand Victorian Filigree Large,Cake,2887.07,389,146,9.2,7.59,0.0141
21584,Retrospot Small Tube Matches,Retrospot,2886.6,1764,221,1.65,0.81,0.0141
23345,Dolly Girl Beaker,Dolly,2886.25,2451,174,1.51,1.12,0.0141
22955,36 Foil Star Cake Cases,36,2885.26,1448,185,2.26,0.0,0.0141
22811,Set Of 6 T-Lights Cacti,Set,2884.13,1021,140,4.01,0.7,0.0141
23283,Doormat Vintage Leaves Design,Doormat,2881.18,430,91,7.85,0.85,0.0141
23056,Flowers Chandelier T-Light Holder,Flowers,2879.37,960,38,6.18,14.89,0.0141
21240,Blue  Spotty Cup,Blue,2877.47,3390,370,0.99,0.9,0.0141
21465,Pink Flower Crochet Food Cover,Pink,2875.6400000000003,793,187,4.03,0.53,0.014
21821,Glitter Star Garland With Bells,Glitter,2866.6,713,153,4.84,1.27,0.014
22072,Tea Cup And Saucer Retro Spot,Tea,2866.34,700,137,4.62,4.55,0.014
22480,Red Tea Towel Classic Design,Red,2863.06,2368,263,1.27,0.0,0.014
21424,Woodland Storage Box Large,Woodland,2861.6400000000003,955,142,4.81,5.96,0.014
23427,Stool Home Sweet Home,Stool,2860.58,237,114,12.97,1.71,0.014
22073,Retro Spot Storage Jar,Retro,2853.29,729,155,4.59,5.44,0.0139
22581,Wood Stocking Christmas Scandispot,Wood,2852.6299999999997,3565,380,0.94,0.26,0.0139
23504,Playing Cards Jubilee Union Jack,Playing,2848.8900000000003,1927,208,1.35,0.0,0.0139
22930,Baking Mould Heart Milk Chocolate,Baking,2846.8,1108,189,3.07,0.52,0.0139
23212,Heart Wreath Decoration With Bell,Heart,2845.89,2284,185,1.5,1.55,0.0139
21324,Hanging Medina Lantern Small,Hanging,2845.71,1014,175,3.7,1.67,0.0139
21688,Silver Plate Candle Bowl Small,Silver,2845.6500000000005,912,142,3.61,0.7,0.0139
22080,Ribbon Reel Polkadots,Ribbon,2843.86,1676,242,2.0,0.57,0.0139
22449,Silk Purse Babushka Pink,Silk,2843.8300000000004,863,218,3.35,0.64,0.0139
21439,Basket Of Toadstools,Basket,2837.54,2259,240,1.55,0.41,0.0139
22576,Swallow Wooden Christmas Decoration,Swallow,2835.08,3132,330,1.06,0.29,0.0138
22285,"Decoration Hen On Nest, Hanging",Decoration,2829.19,1877,147,1.87,0.37,0.0138
22731,3D Christmas Stamps Stickers,3D,2828.62,2018,232,1.54,0.74,0.0138
22710,Wrap I Love London,Wrap,2821.28,7184,173,0.42,2.81,0.0138
22217,T-Light Holder Hanging Lace,T-Light,2814.81,2374,214,1.41,1.37,0.0137
22671,French Laundry Sign Blue Metal,French,2811.3399999999997,1688,246,2.04,1.2,0.0137
21508,Vintage Kid Dolly Card,Vintage,2808.62,6716,541,0.52,0.18,0.0137
35001W,Hand Open Shape Deco.White,Hand,2806.69,883,190,4.09,2.54,0.0137
22452,Measuring Tape Babushka Pink,Measuring,2806.4,1089,207,2.56,1.15,0.0137
84909A,Pink Paisley Quilt,Pink,2797.55,209,30,17.18,0.0,0.0137
22974,Childrens Dolly Girl Mug,Childrens,2795.81,1636,211,2.04,3.2,0.0137
22696,Wicker Wreath Large,Wicker,2790.83,1415,288,2.26,0.0,0.0136
21360,Joy Large Wood Letters,Joy,2790.41,441,100,10.09,0.99,0.0136
22101,Mirror Mosaic Votive Holder,Mirror,2790.27,1909,116,2.33,1.68,0.0136
85199S,Small Hanging Ivory/Red Wood Bird,Small,2789.2799999999997,6022,486,0.58,0.2,0.0136
22949,36 Doilies Dolly Girl,36,2788.5299999999997,1965,162,1.74,1.67,0.0136
84519A,Tomato Charlie+Lola Coaster Set,Tomato,2788.4500000000003,1200,203,2.97,0.0,0.0136
21796,Set Of 3 Red Stripe Baskets,Set,2782.19,324,67,12.66,0.0,0.0136
21728,Metal Medina Lantern,Metal,2773.11,298,40,13.71,4.76,0.0135
21188,3D Hearts  Honeycomb Paper Garland,3D,2771.34,912,128,3.58,1.49,0.0135
21682,Large Medina Stamped Metal Bowl,Large,2767.59,559,152,5.28,1.3,0.0135
85132B,Charlie And Lola Table Tins,Charlie,2767.53,919,123,4.94,0.81,0.0135
22365,Door Mat Respectable House,Door,2765.69,379,123,8.27,0.45,0.0135
22242,5 Hook Hanger Magic Toadstool,5,2763.96,1774,110,1.85,2.37,0.0135
23190,Bundle Of 3 School Exercise Books,Bundle,2761.8999999999996,1702,202,1.8,0.98,0.0135
22081,Ribbon Reel Flora + Fauna,Ribbon,2761.04,1559,302,2.18,0.98,0.0135
21683,Medium Medina Stamped Metal Bowl,Medium,2757.4700000000003,936,152,3.31,0.65,0.0135
23542,Wall Art 70'S Alphabet,Wall,2757.06,356,74,10.15,3.26,0.0135
22675,French Kitchen Sign Blue Metal,French,2754.95,2227,270,1.44,1.44,0.0135
15058C,Ice Cream Design Garden Parasol,Ice,2753.72,470,122,9.67,1.61,0.0134
22145,Christmas Craft Heart Stocking,Christmas,2752.66,1306,197,2.37,0.99,0.0134
84795C,Ocean Stripe Hammock,Ocean,2752.59,325,131,9.48,0.75,0.0134
23147,Single Antique Rose Hook Ivory,Single,2752.2,1868,261,1.53,2.21,0.0134
51014C,"Feather Pen,Coal Black",Feather,2751.5,4268,265,0.83,2.21,0.0134
85015,Set Of 12  Vintage Postcard Set,Set,2750.0,2908,254,1.84,0.0,0.0134
22315,200 Red + White Bendy Straws,200,2749.51,2136,387,1.45,0.51,0.0134
22525,Childrens Garden Gloves Pink,Childrens,2748.79,1946,328,1.65,0.9,0.0134
23266,Set Of 3 Wooden Stocking Decoration,Set,2743.82,2053,319,1.45,0.3,0.0134
23341,Pink Diner Wall Clock,Pink,2741.35,307,121,9.94,0.0,0.0134
22482,Blue Tea Towel Classic Design,Blue,2739.43,2319,214,1.25,0.0,0.0134
23100,Silver Bells Table Decoration,Silver,2739.38,2166,257,1.43,0.38,0.0134
22161,Heart Decoration Rustic Hanging,Heart,2738.28,6726,489,0.7,0.39,0.0134
85183B,Charlie & Lola Wastepaper Bin Flora,Charlie,2731.7599999999998,1725,171,2.45,1.71,0.0133
22066,Love Heart Trinket Pot,Love,2729.16,3435,273,1.16,1.41,0.0133
21788,Kids Rain Mac Blue,Kids,2725.0899999999997,3375,206,0.91,2.74,0.0133
22167,Oval Wall Mirror Diamante,Oval,2724.42,265,174,10.96,5.0,0.0133
16161U,Wrap Suki And Friends,Wrap,2721.92,6676,208,0.42,0.93,0.0133
22818,Card Christmas Village,Card,2720.86,6290,404,0.48,1.22,0.0133
22651,Gentleman Shirt Repair Kit,Gentleman,2720.86,3175,270,1.16,0.0,0.0133
22914,Blue Coat Rack Paris Fashion,Blue,2720.66,570,170,5.45,2.29,0.0133
23164,Regency Cake Slice,Regency,2718.65,578,92,5.58,1.08,0.0133
22650,Ceramic Pirate Chest Money Bank,Ceramic,2717.8799999999997,1786,282,1.85,2.4,0.0133
21808,"Christmas Garland Stars,Trees",Christmas,2715.53,1001,144,3.6,3.31,0.0133
47480,Hanging Photo Clip Rope Ladder,Hanging,2713.9799999999996,1638,150,2.29,1.32,0.0133
22524,Childrens Garden Gloves Blue,Childrens,2713.23,1925,293,1.58,0.67,0.0133
22231,Jigsaw Tree With Birdhouse,Jigsaw,2712.48,2135,297,1.55,5.64,0.0132
21096,Set/6 Fruit Salad  Paper Plates,Set/6,2711.7099999999996,15919,143,0.66,0.69,0.0132
23407,Set Of 2 Trays Home Sweet Home,Set,2709.43,265,133,10.68,2.92,0.0132
47503J,Set/3 Floral Garden Tools In Bag,Set/3,2703.25,343,74,10.9,3.9,0.0132
21744,Snowflake Portable Table Light,Snowflake,2697.1600000000003,898,217,3.18,0.45,0.0132
23333,Ivory Wicker Heart Medium,Ivory,2695.45,2089,233,1.33,0.41,0.0132
22667,Recipe Box Retro Spot Design,Recipe,2694.65,959,178,2.94,4.24,0.0132
85035C,Rose 3 Wick Morris Box Candle,Rose,2693.85,1356,197,3.2,0.49,0.0132
21224,Set/4 Skull Badges,Set/4,2691.91,2171,312,1.25,0.94,0.0131
22479,Daisy Garden Marker,Daisy,2691.19,1939,214,1.58,0.0,0.0131
23264,Set Of 3 Wooden Sleigh Decorations,Set,2690.81,1963,299,1.5,0.32,0.0131
22436,12 Coloured Party Balloons,12,2687.05,4215,289,0.68,1.01,0.0131
21204,Daisies  Honeycomb Garland,Daisies,2682.99,1608,205,1.99,0.96,0.0131
22495,Set Of 2 Round Tins Camembert,Set,2682.32,940,237,3.42,0.42,0.0131
90057,Diamante Ring Assorted In Box.,Diamante,2675.88,1804,37,1.8,0.0,0.0131
22155,Star Decoration Rustic,Star,2671.81,5925,340,0.56,0.84,0.013
21980,Pack Of 12 Red Retrospot Tissues,Pack,2668.33,8616,405,0.39,0.87,0.013
22028,Penny Farthing Birthday Card,Penny,2665.13,6344,507,0.53,0.39,0.013
21923,Red/Cream Stripe Fringe Hammock,Red/Cream,2662.64,337,119,8.58,1.65,0.013
21109,Large Cake Towel Chocolate Spots,Large,2661.67,925,104,5.37,0.44,0.013
85049B,Lush Greens Ribbons,Lush,2653.3,2126,338,1.32,0.0,0.013
21693,Small Hammered Silver Candlepot,Small,2648.6200000000003,871,120,3.39,0.0,0.0129
22500,Set Of 2 Tins Jardin De Provence,Set,2647.31,580,198,5.19,0.5,0.0129
21742,Large Round Wicker Platter,Large,2647.28,437,193,6.05,0.0,0.0129
23146,Triple Hook Antique Ivory Rose,Triple,2645.2599999999998,798,227,3.51,8.7,0.0129
22152,Place Setting White Star,Place,2642.2799999999997,6241,241,0.52,1.58,0.0129
21897,Potting Shed Candle Citronella,Potting,2641.36,866,106,3.11,1.82,0.0129
82600,N0 Singing Metal Sign,N0,2639.42,1225,49,2.67,0.58,0.0129
22270,Happy Easter Hanging Decoration,Happy,2638.67,685,153,4.25,4.24,0.0129
84754,S/15 Silver Glass Baubles In Bag,S/15,2634.59,2083,218,1.55,0.88,0.0129
85049F,Baby Boom Ribbons,Baby,2634.0,2110,314,1.31,0.62,0.0129
22146,Easter Craft Ivy Wreath With Chick,Easter,2633.13,1413,107,2.0,1.8,0.0129
22376,Airline Bag Vintage Jet Set White,Airline,2632.18,529,246,5.22,0.0,0.0129
84012,Magic Sheep Wool Growing From Paper,Magic,2628.47,1838,179,1.73,0.55,0.0128
21422,Porcelain Rose Small,Porcelain,2619.17,3160,147,1.08,1.33,0.0128
22758,Large Purple Babushka Notebook,Large,2618.35,2437,314,1.53,0.93,0.0128
84849D,Hot Baths Soap Holder,Hot,2618.27,1558,260,1.9,1.14,0.0128
22713,Card I Love London,Card,2616.12,6084,368,0.56,0.54,0.0128
72800E,4 Ivory Dinner Candles Silver Flock,4,2613.82,1388,286,2.49,0.34,0.0128
22046,Tea Party  Wrapping Paper,Tea,2613.5,6375,208,0.42,0.95,0.0128
47585A,Pink Fairy Cake Cushion Cover,Pink,2612.88,1084,148,4.46,1.33,0.0128
85034B,3 White Choc Morris Boxed Candles,3,2606.64,1183,152,3.3,0.0,0.0127
85227,Set Of 6 3D Kit Cards For Kids,Set,2605.75,2848,392,1.11,0.66,0.0127
23054,Recycled Acapulco Mat Lavender,Recycled,2604.93,295,130,9.53,0.76,0.0127
85034C,3 Rose Morris Boxed Candles,3,2604.15,1314,197,2.91,2.86,0.0127
23196,Vintage Leaf Magnetic Notepad,Vintage,2601.15,1707,274,1.82,0.98,0.0127
72799E,Ivory Pillar Candle Silver Flock,Ivory,2600.6400000000003,1232,178,2.94,0.56,0.0127
37502,Tea Time Mug In Gift Box,Tea,2599.7900000000004,868,171,3.31,0.57,0.0127
22439,6 Rocket Balloons,6,2599.01,3891,363,0.73,1.33,0.0127
22190,Local Cafe Mug,Local,2591.67,1400,242,2.36,0.41,0.0127
90062,Carnival Bracelet,Carnival,2591.42,204,109,12.66,3.51,0.0127
22199,Frying Pan Red Retrospot,Frying,2590.21,617,217,5.28,1.69,0.0126
22933,Baking Mould Easter Egg Milk Choc,Baking,2585.92,940,122,3.49,1.6,0.0126
84968E,S/16 Vintage Black Cutlery,S/16,2585.45,225,40,12.54,1.01,0.0126
21589,Swallow Giant Tube Matches,Swallow,2583.4500000000003,1119,88,2.5,1.11,0.0126
21171,Bathroom Metal Sign,Bathroom,2578.27,1845,260,1.67,0.0,0.0126
21642,Assorted Tutti Frutti Pen,Assorted,2575.18,4413,251,0.88,5.43,0.0126
23534,Stop For Tea Wall Art,Stop,2572.7,518,41,5.78,0.76,0.0126
82597,Bombs Away Metal Sign,Bombs,2569.6600000000003,1210,215,2.58,0.91,0.0125
22471,Tv Dinner Tray Air Hostess,Tv,2568.76,627,176,5.78,1.12,0.0125
21653,Glass Etched T-Light Holder Large,Glass,2565.67,1246,111,2.27,1.71,0.0125
22828,Regency Mirror With Shutters,Regency,2565.0,17,11,154.09,8.33,0.0125
23292,Spaceboy Childrens Cup,Spaceboy,2557.57,2050,216,1.53,2.62,0.0125
21288,Stripey Chocolate Nesting Boxes,Stripey,2557.4700000000003,982,224,3.34,0.88,0.0125
22939,Apron Apple Delight,Apron,2556.66,516,136,5.72,1.09,0.0125
21499,Blue Spots  Wrap,Blue,2555.0,6350,196,0.42,0.43,0.0125
20960,Watermelon Bath Sponge,Watermelon,2550.84,1900,215,1.66,0.0,0.0125
22735,Ribbon Reel Socks And Mittens,Ribbon,2541.38,1434,231,2.34,0.0,0.0124
85035B,Chocolate 3 Wick Morris Box Candle,Chocolate,2539.29,986,131,3.89,0.0,0.0124
21898,Potting Shed Rose Candle,Potting,2538.8100000000004,827,113,3.0,0.0,0.0124
23131,Mistletoe Heart Wreath Cream,Mistletoe,2535.48,624,110,4.21,1.69,0.0124
20787,Blue Retro Bar Stool,Blue,2535.1,69,30,38.02,0.0,0.0124
21215,Ivory Paper Cup Cake Cases,Ivory,2533.88,4349,291,0.87,0.34,0.0124
22197,"Popcorn Holder , Small",Popcorn,2531.64,3189,112,1.04,3.66,0.0124
21203,Butterflies  Honeycomb Garland,Butterflies,2527.0,1539,145,2.04,1.33,0.0123
23681,Lunch Bag Red Vintage Doily,Lunch,2525.04,1576,132,1.87,0.0,0.0123
22451,Silk Purse Babushka Red,Silk,2521.7200000000003,734,150,3.97,0.81,0.0123
22342,Home Garland Painted Zinc,Home,2521.2499999999995,1817,230,2.04,2.54,0.0123
22350,Cat Bowl,Cat,2521.2400000000002,946,121,2.98,0.6,0.0123
22415,White Tissue Ream,White,2520.15,317,204,7.95,0.0,0.0123
21792,Classic French Style Basket Green,Classic,2517.88,494,141,5.97,4.08,0.0123
21431,Green Gingham Flower Jewellery Box,Green,2511.3599999999997,1483,278,1.94,0.71,0.0123
84968A,S/16 Vintage Rose Cutlery,S/16,2511.24,190,85,14.67,1.91,0.0123
23424,Gingham Recipe Book Box,Gingham,2509.62,462,135,6.19,0.74,0.0123
21323,Hanging Medina Lantern Large,Hanging,2506.89,740,80,5.57,1.23,0.0122
22937,Baking Mould Chocolate Cupcakes,Baking,2502.04,948,157,2.93,1.2,0.0122
23316,Red Refectory Clock,Red,2501.64,250,110,11.11,0.9,0.0122
22291,"Spring Dec , Hanging Chick Cream",Spring,2499.58,1900,142,1.64,0.74,0.0122
82567,"Airline Lounge,Metal Sign",Airline,2498.98,1207,489,2.17,0.2,0.0122
85054,French Enamel Pot W Lid,French,2495.0200000000004,916,204,3.49,2.35,0.0122
23367,Set 12 Colour Pencils Spaceboy,Set,2491.2,3278,282,0.76,0.35,0.0122
85041,Set/4 Pink Orchid Candles In Bowl,Set/4,2489.87,1853,92,1.79,3.06,0.0122
21924,Blue/Cream Stripe Fringe Hammock,Blue/Cream,2486.6600000000003,315,123,8.61,2.36,0.0121
22091,Empire Tissue Box,Empire,2485.86,3179,324,1.26,1.22,0.0121
21680,Woodland  Stickers,Woodland,2483.68,2858,268,1.14,0.37,0.0121
84968F,Set Of 16 Vintage Sky Blue Cutlery,Set,2479.35,214,80,13.2,0.0,0.0121
85206B,Pink Felt Easter Egg Basket,Pink,2477.2999999999997,1538,183,1.82,1.6,0.0121
22742,Make Your Own Playtime Card Kit,Make,2475.3,1002,180,3.09,0.55,0.0121
22129,Party Cones Candy Tree Decoration,Party,2473.16,2792,107,1.2,0.57,0.0121
22153,Angel Decoration Stars On Dress,Angel,2469.16,5705,283,0.55,1.68,0.0121
21686,Medina Stamped Metal Stool,Medina,2460.1400000000003,65,33,39.3,5.71,0.012
23352,Roll Wrap 50'S Red Christmas,Roll,2459.2,1800,212,1.51,0.47,0.012
22829,Sweetheart Wire Wall Tidy,Sweetheart,2458.62,240,117,11.0,1.67,0.012
21616,4 Pear Botanical Dinner Candles,4,2458.58,1152,191,2.47,0.0,0.012
20668,Disco Ball Christmas Decoration,Disco,2454.88,20951,367,0.17,0.53,0.012
22911,Paper Chain Kit London,Paper,2454.3500000000004,853,164,3.22,2.37,0.012
21330,Woodland Animal  Writing Set,Woodland,2454.0699999999997,1452,201,2.28,0.49,0.012
21747,Small Skull Windmill,Small,2452.35,2049,153,1.44,1.91,0.012
21823,Painted Metal Heart With Holly Bell,Painted,2447.72,2468,212,1.31,0.44,0.012
23489,Vintage Bells Garland,Vintage,2443.35,821,149,3.24,0.0,0.0119
21789,Kids Rain Mac Pink,Kids,2437.0699999999997,2920,218,0.94,2.21,0.0119
84840,Sweetheart Carry-All Basket,Sweetheart,2430.82,282,140,9.0,1.41,0.0119
22021,Blue Felt Easter Egg Basket,Blue,2430.31,1413,233,1.79,0.42,0.0119
21809,Christmas Hanging Tree With Bell,Christmas,2427.89,3015,207,1.24,0.0,0.0119
21462,"Nursery A,B,C Painted Letters",Nursery,2425.41,413,171,6.88,3.39,0.0118
23406,Home Sweet Home Key Holder,Home,2422.6600000000003,456,111,7.11,1.77,0.0118
21274,Embossed Heart 3 Drawer Shelf,Embossed,2420.69,175,105,14.66,0.93,0.0118
21973,Set Of 36 Mushroom Paper Doilies,Set,2420.0299999999997,1670,210,1.8,0.94,0.0118
22613,Pack Of 20 Spaceboy Napkins,Pack,2419.7599999999998,3051,273,0.97,0.36,0.0118
21106,Cream Slice Flannel Chocolate Spot,Cream,2419.6800000000003,790,169,3.7,0.0,0.0118
22789,T-Light Holder Sweetheart Hanging,T-Light,2419.54,1238,196,2.13,0.5,0.0118
22609,Pens Assorted Spaceball,Pens,2414.54,7087,201,0.56,1.94,0.0118
22362,Glass Jar Peacock Bath Salts,Glass,2410.53,747,253,3.82,4.89,0.0118
22540,Mini Jigsaw Circus Parade,Mini,2410.29,6162,189,0.5,1.04,0.0118
22897,Oven Mitt Apples Design,Oven,2409.75,1613,264,1.78,1.64,0.0118
23400,Shelf With 4 Hooks Home Sweet Home,Shelf,2409.34,461,107,6.85,0.92,0.0118
23265,Set Of 3 Wooden Tree Decorations,Set,2404.79,1769,293,1.48,0.65,0.0117
85059,French Enamel Water Basin,French,2399.89,701,211,4.29,1.84,0.0117
85036A,Gardenia 1 Wick Morris Boxed Candle,Gardenia,2389.21,619,165,4.13,1.16,0.0117
20674,Green Polkadot Bowl,Green,2385.08,1848,249,1.55,0.64,0.0116
84818,Danish Rose Photo Frame,Danish,2382.25,1788,214,2.04,4.04,0.0116
21531,Retro Spot Sugar Jam Bowl,Retro,2382.2400000000002,921,196,3.24,2.61,0.0116
84795B,Sunset Check Hammock,Sunset,2379.09,298,96,8.96,0.0,0.0116
21811,Hanging Heart With Bell,Hanging,2374.7999999999997,4619,219,0.92,0.25,0.0116
10133,Colouring Pencils Brown Tube,Colouring,2373.2599999999998,3837,289,0.75,0.69,0.0116
47570,English Rose Table Cloth,English,2373.01,220,78,12.24,0.0,0.0116
23498,Classic Bicycle Clips,Classic,2372.68,1640,99,1.66,0.0,0.0116
84997d,Childrens Cutlery Polkadot Pink,Childrens,2372.33,285,65,8.43,0.0,0.0116
23535,Bicycle Saftey Wall Art,Bicycle,2371.94,458,39,5.78,0.46,0.0116
23048,Set Of 10 Lanterns Fairy Light Star,Set,2368.37,577,99,4.67,4.67,0.0116
21262,White Goose Feather Christmas Tree,White,2366.0200000000004,606,132,6.07,3.65,0.0116
85034A,3 Gardenia Morris Boxed Candles,3,2364.82,846,135,3.9,3.4,0.0115
21468,Butterfly Crochet Food Cover,Butterfly,2361.39,669,142,4.02,1.36,0.0115
22537,Magic Drawing Slate Dinosaur,Magic,2360.43,5717,347,0.49,0.28,0.0115
21873,If You Can'T Stand The Heat Mug,If,2360.0099999999998,2010,199,1.67,1.97,0.0115
23401,Rustic Mirror With Lace Heart,Rustic,2354.87,459,83,7.09,3.49,0.0115
23412,Heart Mirror Antique White,Heart,2354.8,358,76,7.72,1.28,0.0115
22421,Lipstick Pen Fuschia,Lipstick,2351.86,4721,406,0.59,1.19,0.0115
21824,Painted Metal Star With Holly Bells,Painted,2351.46,2782,211,1.12,0.45,0.0115
21437,24 Hanging Easter Eggs Floral Tub,24,2350.92,677,109,3.97,1.72,0.0115
21126,Set Of 6 Girls Celebration Candles,Set,2349.22,2325,285,1.34,0.69,0.0115
22642,Set Of 4 Napkin Charms Stars,Set,2348.4700000000003,989,141,2.58,0.0,0.0115
23396,Le Jardin Botanique Cushion Cover,Le,2345.0,559,166,4.78,0.5,0.0115
85035A,Gardenia 3 Wick Morris Boxed Candle,Gardenia,2344.9,646,178,4.32,3.7,0.0115
23437,50'S Christmas Gift Bag Large,50'S,2343.63,1915,129,1.43,0.76,0.0114
84459B,Yellow Metal Chicken Heart,Yellow,2341.77,1475,213,2.12,0.46,0.0114
84509F,Set Of 4 New England Placemats,Set,2336.1,2749,36,3.99,0.0,0.0114
ADJUST,Adjustment By John On 26/01/2010 16,Adjustment,2334.43,20,20,116.72,46.27,0.0114
21826,Eight Piece Dinosaur Set,Eight,2326.87,1800,240,1.46,2.73,0.0114
22251,Birdhouse Decoration Magic Garden,Birdhouse,2317.64,1871,298,1.56,1.31,0.0113
22306,Silver Mug Bone China Tree Of Life,Silver,2316.2,1621,163,2.03,2.37,0.0113
21615,4 Lavender Botanical Dinner Candles,4,2308.67,1168,169,2.35,0.0,0.0113
23371,Set 36 Colour Pencils Spaceboy,Set,2304.78,1705,185,1.52,0.0,0.0113
22363,Glass Jar Marmalade,Glass,2303.3900000000003,781,169,3.64,7.03,0.0112
21947,Set Of 6 Heart Chopsticks,Set,2302.81,1675,298,1.72,0.0,0.0112
22983,Card Billboard Font,Card,2300.21,5395,451,0.53,0.54,0.0112
71459,Hanging Jam Jar T-Light Holders,Hanging,2298.05,2813,92,1.04,3.32,0.0112
21482,Mushroom Blue Hot Water Bottle,Mushroom,2296.76,740,184,3.63,0.54,0.0112
21741,Cosy Slipper Shoes Large Green,Cosy,2293.7500000000005,701,190,3.83,0.52,0.0112
85176,Sewing Susan 21 Needle Set,Sewing,2293.0,2748,306,1.14,1.29,0.0112
22566,Feltcraft Hairband Pink And Purple,Feltcraft,2292.22,2740,289,0.99,0.0,0.0112
84536A,English Rose Notebook A7 Size,English,2289.73,5077,613,0.53,0.32,0.0112
84997b,Childrens Cutlery Retrospot Red,Childrens,2287.37,273,55,8.62,0.0,0.0112
23330,Decorative Wicker Heart Medium,Decorative,2286.97,1794,216,1.36,0.45,0.0112
21464,Disco Ball Rotator Battery Operated,Disco,2286.75,539,217,4.25,4.41,0.0112
22831,White Brocante Soap Dish,White,2286.28,776,138,3.34,0.0,0.0112
85199L,Large Hanging Ivory & Red Wood Bird,Large,2285.02,3455,272,0.84,1.43,0.0112
23029,Drawer Knob Crackle Glaze Green,Drawer,2284.12,1340,154,1.84,4.88,0.0112
20665,Red Spotty Purse,Red,2278.17,736,156,3.58,1.41,0.0111
21655,Hanging Ridge Glass T-Light Holder,Hanging,2277.5,1396,89,1.96,6.32,0.0111
85183A,Charlie & Lola Wastepaper Bin Blue,Charlie,2275.75,1512,141,2.36,2.72,0.0111
