stockcode,description,category,revenue,qty_sold,orders,avg_price,cancel_rate,revenue_share
72811,Small Zinc/Glass Candleholder,Small,340.45,445,22,1.45,0.0,0.0017
23523,Wall Art Treasure Ahoy,Wall,340.35,90,25,4.16,2.38,0.0017
75149N,String Crystals Natural,String,340.0,272,25,1.25,0.0,0.0017
79303B,Blue Star Block Table Lamp,Blue,339.57,109,10,4.75,0.0,0.0017
84925A,Wake Up Cockerel Wall Thermometer,Wake,339.29,179,17,2.81,0.0,0.0017
84576,Blue Cat Biscuit Barrel Pink Heart,Blue,337.04,96,32,4.89,0.0,0.0016
23127,Dollcraft Girl Nicole,Dollcraft,336.6,68,12,4.95,1.51,0.0016
35914,Pink Chick Egg Warmer + Egg Cup,Pink,336.58,243,56,1.64,0.0,0.0016
17011F,Origami Sandlewood Incense+Flower,Origami,336.2,385,20,2.12,0.0,0.0016
20847,Zinc Heart Lattice Charger Large,Zinc,334.35,80,27,4.75,3.57,0.0016
17109A,Flower Fairy Incense Lily,Flower,333.61,709,13,1.19,0.0,0.0016
21402,Red  Egg  Spoon,Red,333.42,1698,151,0.37,0.65,0.0016
90175C,Blue Glass Chunky Charm Bracelet,Blue,332.95,37,20,9.04,0.0,0.0016
20688,Beauty Speed Expresso Cups,Beauty,332.9,464,11,6.0,0.0,0.0016
47583B,Set Of 3 Wicker Basket Tea And Cake,Set,332.6,27,6,21.96,0.0,0.0016
21420,Oyster Trinket Box,Oyster,332.16,120,31,3.61,0.0,0.0016
35637C,Pink String Curtain With Pole,Pink,331.14,100,19,6.51,0.0,0.0016
85024B,Eau De Nile Jewelled Photoframe,Eau,330.9,218,20,1.64,0.0,0.0016
84870C,Green Geisha Girl,Green,330.36,93,41,3.45,0.0,0.0016
35921,Easter Bunny Hanging Garland,Easter,330.32,183,49,2.83,1.96,0.0016
90129B,Turquoise Glass Tassle Bag Charm,Turquoise,329.95,146,62,2.07,0.0,0.0016
37467,Pig Mug In Two Colour Designs,Pig,328.51,273,64,2.59,0.0,0.0016
72739B,White Chocolate Scent Candle,White,328.39,394,28,1.84,0.0,0.0016
90014B,Gold M Pearl  Orbit Necklace,Gold,327.81,32,26,10.25,0.0,0.0016
21722,Sweet Pudding Sticker Sheet,Sweet,327.75,347,79,1.15,2.47,0.0016
23236,Doiley Biscuit Tin,Doiley,327.59999999999997,120,13,2.86,4.9,0.0016
84902,Pink Knitted Cow Stuffed Toy,Pink,326.33,84,53,3.93,0.0,0.0016
84706A,English Rose Table Clock,English,325.88,137,7,7.34,0.0,0.0016
21309,Louvre Chalkboard,Louvre,325.6,49,5,9.16,16.67,0.0016
22045,Space Boy Gift Wrap,Space,325.5,775,27,0.42,1.05,0.0016
90209A,Purple Enamel+Glass Hair Comb,Purple,325.5,173,10,2.0,16.67,0.0016
23037,Candle Holder Silver Madeline,Candle,325.15999999999997,196,20,1.89,0.0,0.0016
23478,Woodland Large Pink Felt Heart,Woodland,324.40000000000003,285,13,1.51,0.0,0.0016
23521,Cat And Bird Wall Art,Cat,323.64,270,4,2.0,0.0,0.0016
90175B,Pink Glass Chunky Charm Bracelet,Pink,322.85,36,27,8.97,3.57,0.0016
84870B,Blue Geisha Girl,Blue,322.61,90,40,3.66,2.44,0.0016
90197B,Black Glass Bracelet W Heart Charms,Black,322.52,64,51,5.05,0.0,0.0016
90178A,Amber Chunky Glass+Bead Necklace,Amber,322.40999999999997,27,21,11.94,0.0,0.0016
23205,Charlotte Bag Alphabet  Design,Charlotte,320.5,400,22,0.84,1.67,0.0016
72801G,4 Burgundy Wine Dinner Candles,4,320.2,537,38,1.3,0.0,0.0016
85131C,Beaded Crystal Heart Blue On Stick,Beaded,320.15,439,72,0.94,0.0,0.0016
85070,Ant White Sweetheart Table W 3 Draw,Ant,320.0,3,3,106.67,25.0,0.0016
22287,Decoration Wobbly Chicken,Decoration,319.14,560,45,1.18,0.82,0.0016
84795b,Sunset Check Hammock,Sunset,317.71999999999997,19,17,16.71,0.0,0.0016
85089,Candy Spot Bunny,Candy,317.54,99,29,3.9,0.0,0.0016
85033S,Set/6 Silver Reindeer T-Lights,Set/6,317.34999999999997,258,49,1.57,1.96,0.0015
84933C,Large Blue Oriental Folding Stool,Large,317.0,136,6,4.72,0.0,0.0015
90018A,Silver M.O.P Orbit Drop Earrings,Silver,316.99,75,56,4.22,1.75,0.0015
17091B,Jasmine Tea Incense In Tin,Jasmine,316.98,276,51,1.42,0.0,0.0015
21401,Blue Pudding Spoon,Blue,315.7,1437,121,0.32,0.0,0.0015
84509G,Fairy Cake Placemats,Fairy,315.55,82,27,4.59,0.0,0.0015
85129B,Beaded Crystal Heart Green Small,Beaded,315.11,233,56,1.73,0.0,0.0015
84673A,Pink Fly Swat,Pink,314.84,500,99,0.74,0.98,0.0015
84933A,Large Green Peony Folding Stool,Large,314.34999999999997,131,6,4.72,0.0,0.0015
46000U,Polyester Filler Pad 30Cmx30Cm,Polyester,313.75,251,51,1.25,0.0,0.0015
90000D,Copper/Olive Green Flower Necklace,Copper/Olive,313.75,51,34,6.21,0.0,0.0015
35638B,Pink/Blue String Curtain,Pink/Blue,313.28999999999996,118,11,6.6,0.0,0.0015
37343,Polkadot Mug Pink,Polkadot,313.26,193,30,2.05,0.0,0.0015
23695,Doily Thank You Card,Doily,313.24,741,57,0.5,0.0,0.0015
23130,Miseltoe Heart Wreath,Miseltoe,312.8,80,5,4.07,1.08,0.0015
84802A,White Anemone Artificial Flower,White,312.65000000000003,185,24,1.69,0.0,0.0015
84838,Ant White High Rise Bird Box,Ant,312.5,50,4,7.88,0.0,0.0015
90016B,Gold/M.O.P Pendant Orbit Necklace,Gold/M.O.P,312.14,37,30,8.43,0.0,0.0015
84522,Pink Party Sunglasses,Pink,311.86,186,26,1.86,0.0,0.0015
84984C,Oriental Blue Cushion Cover,Oriental,311.57,219,8,4.28,0.0,0.0015
35979,Six String Scandinavian Heart Decs,Six,311.03000000000003,94,27,3.82,6.67,0.0015
62095B,Turqoise Ice Cream Sunhat,Turqoise,310.83,292,21,1.56,0.0,0.0015
84623,Pink Gingham Rose Floor Cushion,Pink,310.44,56,14,8.07,0.0,0.0015
84933B,Large Pink Peony Folding Stool,Large,309.15,136,6,3.41,0.0,0.0015
84661A,White Square Table Clock,White,308.99,222,43,2.92,0.0,0.0015
20795,Large Blue Provencal Ceramic Ball,Large,308.7,135,29,2.96,9.38,0.0015
22844,Vintage Dog Food Container,Vintage,308.64,36,6,8.61,1.76,0.0015
77081,Flower Windmill,Flower,308.38,242,33,1.78,2.94,0.0015
21196,Round White Confetti In Tube,Round,306.89,178,22,1.94,0.0,0.0015
22453,Measuring Tape Russian Doll Blue,Measuring,306.81000000000006,103,28,3.06,2.03,0.0015
84671B,Crochet Bear With Blue Stripes,Crochet,306.77,109,32,3.19,0.0,0.0015
23495,Set Of 3 Pantry Wooden Spoons,Set,306.66,225,41,1.72,0.0,0.0015
90173,Pair Butterfly Hair Clips,Pair,306.64,81,51,3.8,1.89,0.0015
72130,Columbian Candle Round,Columbian,306.35,753,57,0.68,0.0,0.0015
16254,Transparent Acrylic Tape Dispenser,Transparent,305.66,941,40,1.27,0.0,0.0015
23131,Miseltoe Heart Wreath White,Miseltoe,304.5,78,4,4.05,1.69,0.0015
20800,Large Glass Sundae Dish Clear,Large,303.96,1005,5,3.62,0.0,0.0015
84219,Box/12 Mother & Chick In Basket/Bow,Box/12,303.86,137,28,2.6,0.0,0.0015
72753D,S/3 Flwr Fairy Summer Candles,S/3,302.40000000000003,144,9,2.1,18.18,0.0015
90036D,"Flower Glass Garland Neckl.36""Black",Flower,302.29,38,16,7.96,0.0,0.0015
84968e,Set Of 16 Vintage Black Cutlery,Set,302.16999999999996,12,9,25.2,0.0,0.0015
85147,Jardin Etched Glass Candlehldr Long,Jardin,301.95,61,16,4.95,5.0,0.0015
23430,Blue Retro Kitchen Wall Clock,Blue,301.88,36,18,8.62,0.0,0.0015
35645,Vintage Bead Pink Jewel Box,Vintage,301.81,61,34,5.5,0.0,0.0015
21321,Glass Chalice Blue  Large,Glass,301.8,122,18,3.08,14.29,0.0015
23522,Wall Art Dog And Ball,Wall,301.56,102,28,3.88,0.0,0.0015
90098,Necklace+Bracelet Pink Butterfly,Necklace+Bracelet,301.28,137,55,2.32,1.79,0.0015
90035C,"Pearl & Shell 42""Neckl. Ivory",Pearl,301.0,28,5,10.75,0.0,0.0015
22852,Enamel Dog Bowl Cream,Enamel,300.48,76,3,4.21,1.23,0.0015
84509E,Set Of 4 Carousel Placemats,Set,300.3,157,29,4.03,0.0,0.0015
23440,Paint Your Own Eggs In Crate,Paint,299.36,164,5,2.02,0.0,0.0015
17001,Heavens Scent Fragrance Oils Asstd,Heavens,299.34999999999997,1211,23,0.28,8.0,0.0015
90124A,Pink Murano Twist Necklace,Pink,299.28,30,20,9.99,0.0,0.0015
18096C,White Round Porcelain Tlight Holder,White,298.7,117,20,3.45,9.09,0.0015
35981C,White Snow Scandinavian Stocking,White,297.62,589,67,0.66,0.0,0.0015
84627,Candy Stripe Rose C/Cover,Candy,297.5,50,19,5.95,4.76,0.0015
84509C,Set Of 4 Dotty Placemats,Set,297.48,70,23,5.06,0.0,0.0015
84247N,Pack/12 Blue Folkart Cards,Pack/12,297.48,113,53,2.39,5.36,0.0015
22135,Mini Ladle Love Heart Pink,Mini,297.4,528,166,0.67,0.63,0.0015
21157,Red Retrospot Washbag,Red,296.99,103,44,3.37,0.56,0.0015
17012E,Origami Opium Incense/Candle Set,Origami,296.78999999999996,263,29,2.49,0.0,0.0014
79190D,Retro Plastic Daisy Tray,Retro,296.58,641,112,0.56,0.88,0.0014
35920,Four Rabbit Easter Decorations,Four,296.34,1070,24,1.67,0.0,0.0014
47471,Rainbow Pegs Photo Clip String,Rainbow,295.72,428,63,0.96,0.0,0.0014
DCGSSGIRL,Girls Party Bag,Girls,295.63,92,23,3.23,0.0,0.0014
79051A,Smokey Grey Colour D.O.F. Glass,Smokey,295.58,702,39,0.84,0.0,0.0014
90129A,Pink Glass Tassle Bag Charm,Pink,295.38,151,73,1.94,0.0,0.0014
20869,Gold Fabric Mirror,Gold,295.12,529,53,0.94,0.0,0.0014
21697,Set 5 Mini Doughnut Fridge Magnet,Set,295.08000000000004,372,7,1.49,0.0,0.0014
23126,Dollcraft Girl Amelie Kit,Dollcraft,294.7,66,8,4.85,2.01,0.0014
90185D,Crystal Diamante Expandable Ring,Crystal,293.33,69,35,4.25,5.41,0.0014
84926A,Wake Up Cockerel Tile Coaster,Wake,293.08,664,51,0.98,0.0,0.0014
84482,Buttons Design Jewellery Box,Buttons,293.02,75,32,4.11,5.71,0.0014
72801F,S/4 Festive Red Dinner Candles,S/4,292.5,234,25,1.25,0.0,0.0014
90030B,Red Kukui Coconut Seed Necklace,Red,292.08000000000004,139,36,4.01,0.0,0.0014
37422,White With Black Cats Bowl,White,292.08,434,73,1.35,0.0,0.0014
84800S,Small White/Pink Rose Art Flower,Small,292.03999999999996,388,19,1.1,5.0,0.0014
22952,Set 72 Cake Cases Vintage Christmas,Set,291.6,672,4,0.52,0.42,0.0014
23567,Egg Cup Henrietta Hen Pink,Egg,291.58,211,37,1.82,2.56,0.0014
21030,Space Cadet Red,Space,290.9,239,51,1.2,0.0,0.0014
84529A,Pink Knitted Kids Rucksack,Pink,290.78,50,19,6.56,0.0,0.0014
20826,Silver Aperitif Glass,Silver,290.72,355,14,1.35,0.0,0.0014
16202A,Pastel Pink Photo Album,Pastel,290.45,662,21,4.49,12.5,0.0014
21388,Ivory Hanging Decoration  Chicken,Ivory,290.16999999999996,311,29,0.92,0.0,0.0014
23410,Curio Cabinet Linen And Lace,Curio,290.1,36,18,8.03,5.26,0.0014
84882,Green Wire Standing Candle Holder,Green,289.43,66,36,4.7,0.0,0.0014
85014a,Black/Blue Polkadot Umbrella,Black/Blue,288.92,23,19,12.57,0.0,0.0014
23015,Cordial Glass Jug,Cordial,288.88,34,16,8.74,13.64,0.0014
20987,Geisha Girl Chopsticks Set/5,Geisha,288.35,131,22,3.02,0.0,0.0014
23047,Paper Lantern 5 Point Sequin Star,Paper,287.5,50,21,5.75,0.0,0.0014
21144,Pink Poodle Hanging Decoration,Pink,287.47,543,60,1.04,1.61,0.0014
84997a,Green 3 Piece Polkadot Cutlery Set,Green,287.08000000000004,34,10,8.38,0.0,0.0014
16212,Funky Girlz Asst Magnetic Memo Pad,Funky,287.01,366,37,1.68,0.0,0.0014
20821,Goldie Looking Mirror,Goldie,286.42,42,25,7.88,10.71,0.0014
37413,Icon Mug Revolutionary,Icon,284.49,703,81,0.41,0.0,0.0014
90185B,Amethyst Diamante Expandable Ring,Amethyst,284.43,67,34,4.24,12.82,0.0014
84247E,Pack Of 12 Christmas Fun Cards,Pack,283.79,106,37,2.63,7.69,0.0014
82093,Heart Shape Button Frame,Heart,283.49,139,28,3.15,0.0,0.0014
20980,36 Pencils Tube Posy,36,282.31,233,58,1.4,1.67,0.0014
22546,Mini Jigsaw Fido,Mini,282.24,672,10,0.42,0.55,0.0014
85049g,Chocolate Box Ribbons,Chocolate,281.44,115,52,2.43,0.0,0.0014
84977,Wire Flower T-Light Holder,Wire,281.33,223,44,1.31,0.0,0.0014
16052,Teatime Push Down Rubber,Teatime,281.32,848,35,0.57,2.78,0.0014
23481,Pearlised Ivory Heart Small,Pearlised,281.17,228,29,1.28,0.0,0.0014
90163A,Pink Rosebud & Pearl Necklace,Pink,280.71,37,24,7.61,0.0,0.0014
47578A,English Rose Small Scented Flower,English,279.88,307,69,1.05,0.0,0.0014
84508C,Blue Circles Design Teddy,Blue,279.82,103,43,2.95,2.27,0.0014
72739C,Dark Chocolate Scentcandle,Dark,279.08,326,23,1.68,8.0,0.0014
84625B,Blck New Baroque Candlestick Candle,Blck,279.0,180,17,2.33,5.56,0.0014
21412,Vintage Gold Tinsel Reel,Vintage,279.0,275,67,1.73,2.63,0.0014
90115,Summer Butterflies Bag Charm,Summer,278.96,108,60,2.63,0.0,0.0014
22954,Hen Party Cordon Barrier Tape,Hen,278.89,226,49,1.39,1.96,0.0014
84457,Set/3 Rabbits Flower Skippping Rope,Set/3,278.72999999999996,291,64,1.15,0.0,0.0014
21367,Mirrored Wall Art Gents,Mirrored,278.47999999999996,211,60,2.57,0.0,0.0014
84926F,Psychedelic Tile Coaster,Psychedelic,277.9,484,42,1.42,2.33,0.0014
23413,Decorative Vintage Coffee  Box,Decorative,277.0,52,22,6.24,1.69,0.0014
44235,Ass Col Circle Mobile,Ass,276.96,752,15,0.41,0.0,0.0014
90146,Fine Silver Necklace W Pastel Flowe,Fine,276.49,41,19,7.45,4.76,0.0014
22889,Number Tile Vintage Font No,Number,276.42,173,36,3.62,2.44,0.0013
84966C,Green Kashmiri Boxed Mirror,Green,276.0,23,2,12.0,0.0,0.0013
DCGS0076,Sunjar Led Night Night Light,Sunjar,275.96,17,14,16.26,0.0,0.0013
23137,Zinc Wire Sweetheart Letter Tray,Zinc,275.62,83,23,3.98,0.0,0.0013
90085,Crystal Stiletto Phone Charm,Crystal,275.53,311,29,1.18,6.45,0.0013
21095,Set/6 Posies Paper Plates,Set/6,274.57,295,40,1.01,0.0,0.0013
84924F,Psychedelic Metal Sign Calendar,Psychedelic,274.55,975,10,2.95,9.09,0.0013
21193,White Honeycomb Paper Fan,White,274.37,111,22,2.84,0.0,0.0013
75178,Asstd Col Butterfly/Crystal W/Chime,Asstd,273.93,497,25,1.5,0.0,0.0013
90122A,Pink Crystal+Glass Bracelet,Pink,273.89,55,31,5.0,0.0,0.0013
84927F,Psychedelic Tile Hook,Psychedelic,273.32,335,62,1.6,3.03,0.0013
23141,Triple Wire Hook Pink Heart,Triple,272.91,79,25,4.24,0.0,0.0013
84924D,La Palmiera Metal Sign Calendar,La,272.61,764,15,3.8,0.0,0.0013
23203,Jumbo Bag Vintage Doiley,Jumbo,272.57,144,7,2.33,1.35,0.0013
79303D,Lilac Flower Block Table Lamp,Lilac,272.45,78,19,4.86,9.52,0.0013
35096A,Blue Victorian Fabric Heart Box,Blue,272.45,765,50,0.67,0.0,0.0013
84499,Black Flower Candle Plate,Black,272.16999999999996,326,41,1.24,0.0,0.0013
90185C,Black Diamante Expandable Ring,Black,271.96,64,32,4.25,17.95,0.0013
90032,Ivory Shell Heart Necklace,Ivory,271.88,48,24,6.12,0.0,0.0013
90014C,Silver/Black Orbit Necklace,Silver/Black,271.33,27,18,10.1,0.0,0.0013
84192,Assorted Colour Metal Cat,Assorted,271.1,226,38,1.24,0.0,0.0013
23474,Woodland Small Blue Felt Heart,Woodland,270.96000000000004,312,37,1.04,0.0,0.0013
21629,Square Floor Cushion Vintage Pink,Square,270.47,19,14,14.65,0.94,0.0013
47586A,Pink Fairy Cake Cushion Cover,Pink,270.43,200,29,2.32,0.0,0.0013
47351B,Blue  Voile Lampshade,Blue,269.90000000000003,98,14,2.92,6.67,0.0013
85195,Hanging Heart Basket,Hanging,269.44000000000005,146,17,2.21,5.56,0.0013
90122C,Turquoise Crystal+Glass Bracelet,Turquoise,269.1,54,30,5.01,0.0,0.0013
72793,Black Box Mirror Lantern,Black,268.75,55,10,5.56,9.09,0.0013
20818,Gold Teddy Bear,Gold,268.5,87,30,4.49,0.0,0.0013
21372,Mirrored Wall Art Table Lamp,Mirrored,267.01,156,50,2.59,0.0,0.0013
79030D,Tumbler Baroque,Tumbler,266.19,525,40,0.93,1.61,0.0013
23489,"Garland, Vintage Bells","Garland,",265.88,92,10,2.89,0.0,0.0013
47481,50Cm Metal String With  7 Clips,50Cm,265.4,326,44,1.11,0.0,0.0013
23476,Woodland Large Red Felt Heart,Woodland,264.72,205,22,1.47,0.0,0.0013
21950,Set Of 6 Dots Chopsticks,Set,263.63,211,18,2.4,10.0,0.0013
90157,Riviera Necklace,Riviera,263.28000000000003,53,24,4.98,0.0,0.0013
90129E,Purple Glass Tassle Bag Charm,Purple,263.14,129,59,1.92,0.0,0.0013
84906,Pink B'Fly C/Cover W Bobbles,Pink,262.62,43,16,6.37,4.55,0.0013
84806A,Pink Candystuft Artificial Flower,Pink,261.90999999999997,319,20,1.14,0.0,0.0013
23194,Gymkhanna Treasure Book Box,Gymkhanna,261.84000000000003,120,14,2.19,3.56,0.0013
21268,Vintage Blue Tinsel Reel,Vintage,261.66,397,49,1.29,0.0,0.0013
79328,Blue Flock Glass Candleholder,Blue,260.76,594,17,1.49,5.56,0.0013
72799D,Blue Pillar Candle Silver Flock,Blue,260.67,78,18,3.74,0.0,0.0013
44234,Assorted Circular Mobile,Assorted,260.39,1213,56,0.38,1.61,0.0013
84597B,Retro Brown Ball Ashtray,Retro,259.37,205,27,1.61,3.57,0.0013
85095,Three Canvas Luggage Tags,Three,259.09,174,49,1.8,0.0,0.0013
23032,Doorknob Cracked Glaze Ivory,Doorknob,258.3,174,5,1.61,5.14,0.0013
84613C,Blue New Baroque Flock Candlestick,Blue,258.06,62,12,4.58,0.0,0.0013
72801D,4 Sky Blue Dinner Candles,4,257.93,381,29,1.45,0.0,0.0013
90035A,"Pearl & Shell 42""Neckl. Green",Pearl,257.55,24,16,10.72,0.0,0.0013
84520b,Pack 20 English Rose Paper Napkins,Pack,257.4,110,10,2.08,0.0,0.0013
85179C,Pink Bitty Light Chain,Pink,257.15,116,40,3.18,0.0,0.0013
84371,Big Pink Poodle,Big,257.1,30,6,17.38,0.0,0.0013
90040B,Murano Style Glass Bracelet Black,Murano,255.97,71,36,3.67,0.0,0.0013
22870,Number Tile Cottage Garden 2,Number,254.56,98,43,3.24,0.0,0.0012
17038,Porcelain Budah Incense Holder,Porcelain,254.51000000000002,2559,55,0.43,0.0,0.0012
10123C,Hearts Wrapping Tape,Hearts,254.41000000000003,650,63,0.79,3.08,0.0012
22869,Number Tile Cottage Garden 1,Number,253.94,100,46,3.14,1.72,0.0012
84461,12 Pink Hen+Chicks In Basket,12,253.79,99,40,2.61,4.76,0.0012
gift_0001_50,Dotcomgiftshop Gift Voucher £50.00,Dotcomgiftshop,253.59,6,6,42.26,0.0,0.0012
21493,Vintage Design Gift Tags,Vintage,252.45,272,29,1.05,0.0,0.0012
79338,Dark Pink Flock Glass Candleholder,Dark,252.29,553,13,1.47,0.0,0.0012
21032,Space Cadet White,Space,252.16,203,50,1.4,1.96,0.0012
21370,Mirrored Wall Art Foxy,Mirrored,251.97,54,22,7.36,0.0,0.0012
90208,Pair Of Enamel Flower Cluster Slide,Pair,251.59,105,30,2.54,1.45,0.0012
23149,Antique Ivory Wire Bowl Small,Antique,251.45,99,21,2.73,8.7,0.0012
DCGSSBOY,Boys Party Bag,Boys,251.35,77,21,3.23,0.0,0.0012
90081C,Lily Brooch Olive Colour,Lily,250.47,50,36,5.03,0.0,0.0012
90073,Vintage Enamel & Crystal Earrings,Vintage,250.34,50,34,5.03,0.0,0.0012
20836,French Paisley Cushion Cover,French,250.00000000000003,224,22,1.12,8.33,0.0012
21460,Green Easter Egg Hunt Start Post,Green,249.64999999999998,113,27,2.37,6.9,0.0012
90170,Daisy Hair Band,Daisy,249.57999999999998,150,73,1.67,1.35,0.0012
90087,Crystal Sea Horse Phone Charm,Crystal,249.55999999999997,311,53,1.38,3.64,0.0012
22984,"Card, Gingham Rose","Card,",249.44,596,47,0.46,0.0,0.0012
22812,Pack 3 Boxes Christmas Panettone,Pack,248.48,76,24,3.31,1.25,0.0012
84030c,Knitted Rainbow Hot Water Bottle,Knitted,248.0,32,13,7.72,0.0,0.0012
22328,"Round Snack Boxes ,Set 4, Fruits",Round,247.8,84,5,2.95,2.01,0.0012
23168,Classic Sugar Dispenser,Classic,247.32,216,12,1.2,5.0,0.0012
84621,Blue Gingham Rose Floor Cushion,Blue,247.26,29,15,9.06,0.0,0.0012
90036C,"Flower Glass Garland Neckl.36""Blue",Flower,246.83,31,15,7.98,0.0,0.0012
82011A,"Bathroom Scales, Tropical Beach",Bathroom,246.58,59,34,4.36,2.86,0.0012
47503H,Ass Floral Print Spirit Level,Ass,246.12,160,60,1.92,1.56,0.0012
46307,Roses Blue Base Cushion Cover,Roses,246.03,51,33,5.26,0.0,0.0012
22176,Blue Owl Decoration,Blue,244.8,96,1,2.55,1.52,0.0012
22175,Pink Owl Decoration,Pink,244.8,96,1,2.55,0.82,0.0012
90028,New Baroque Large Necklace Blk/Whit,New,244.79,29,24,8.44,0.0,0.0012
84993B,75 Black Petit Four Cases,75,243.66,551,86,0.46,0.0,0.0012
90096,Necklace+Bracelet Set Blue Blossom,Necklace+Bracelet,243.60999999999999,104,49,2.47,0.0,0.0012
90129C,Green Glass Tassle Bag Charm,Green,243.38,107,51,2.11,0.0,0.0012
90119,Metalic Leaves Bag Charms,Metalic,243.07,97,42,2.54,0.0,0.0012
90081A,Lily Brooch Amethyst Colour,Lily,242.8,49,24,4.96,0.0,0.0012
90196A,Purple Gemstone Necklace 45Cm,Purple,242.25,19,11,12.75,8.33,0.0012
23475,Woodland Small Pink Felt Heart,Woodland,242.18,286,31,0.96,0.0,0.0012
35818P,"Acrylic Jewel Icicle, Pink",Acrylic,242.15,559,25,0.97,0.0,0.0012
90196B,Black Gemstone Necklace 45Cm,Black,241.98,19,14,12.73,0.0,0.0012
16156L,"Wrap, Carousel","Wrap,",241.5,575,22,0.42,0.0,0.0012
23143,Zinc Wire Kitchen Organiser,Zinc,239.97,30,16,9.93,0.0,0.0012
84984D,Oriental Red Cushion Cover,Oriental,239.8,132,10,3.97,0.0,0.0012
23324,Rustic Strawberry Jampot Large,Rustic,238.56,120,6,2.04,4.35,0.0012
23028,Doorknob Cracked Glaze Blue,Doorknob,238.5,162,3,1.58,2.13,0.0012
22447,Pin Cushion Russian Doll Blue,Pin,238.06,68,23,3.8,1.2,0.0012
84629,White 3 Frame Birds And Tree,White,237.8,24,13,12.8,7.14,0.0012
82553,Pop'S Greasy Spoon Metal Sign,Pop'S,237.73,114,42,2.58,0.0,0.0012
22882,Number Tile Vintage Font 3,Number,237.72,118,49,2.97,1.96,0.0012
84510C,Set Of 4 Polkadot Coasters,Set,237.59,152,61,1.75,0.0,0.0012
90133,Teal/Fuschia Col Bead Necklace,Teal/Fuschia,236.46,47,36,5.06,0.0,0.0012
44217M,Multicolour Feathers Curtain,Multicolour,236.40000000000003,72,3,3.62,40.0,0.0012
20891,Large Glass Rose Scented Candle,Large,236.33,684,3,8.13,0.0,0.0012
82585,Sweet Valencia Candle+Cup,Sweet,235.9,164,47,1.88,2.0,0.0012
90210D,Purple Acrylic Faceted Bangle,Purple,235.73000000000002,142,23,2.5,0.0,0.0012
23580,Snack Tray Happy Forest,Snack,234.92,116,25,2.21,0.0,0.0011
20855,Pink Patch Purse Blue Heart,Pink,234.29999999999998,142,47,1.65,2.08,0.0011
84796a,Pink Hawaiian Picnic Hamper For 2,Pink,234.28,28,20,8.37,0.0,0.0011
84660c,Pink Stitched Wall Clock,Pink,233.98,31,28,7.55,0.0,0.0011
20736,Pink Mini Tape Measure,Pink,233.5,290,19,0.84,0.0,0.0011
84247K,"Folk Art Greeting Card,Pack/12",Folk,233.48000000000002,75,28,3.28,3.45,0.0011
90185A,Amber Diamante Expandable Ring,Amber,233.29,55,26,4.23,10.34,0.0011
37483,English Rose Mug In Gift Box,English,232.89,143,10,2.46,7.69,0.0011
84797b,Blue Savannah Picnic Hamper For 4,Blue,232.62,21,19,11.08,0.0,0.0011
23036,T-Light Holder Silver Petit Four,T-Light,232.42000000000002,184,16,1.33,0.0,0.0011
16256B,Flower Pencil/Rubber+5 Mini Pencils,Flower,232.35,524,35,0.58,0.0,0.0011
35991,Set/6 Black Snowflake T-Lights,Set/6,232.08,402,54,0.87,0.0,0.0011
90210B,Clear Acrylic Faceted Bangle,Clear,232.04000000000002,102,24,2.71,0.0,0.0011
23447,Pink Bunny Easter Egg Basket,Pink,231.9,158,4,1.6,0.0,0.0011
22878,Number Tile Cottage Garden No,Number,231.54,83,40,3.48,2.17,0.0011
90181B,Amethyst Glass/Shell/Pearl Necklace,Amethyst,231.27,25,24,9.26,0.0,0.0011
16202C,Beige Photo Album,Beige,230.59,97,12,3.98,0.0,0.0011
21226,Pocket Mirror Woodland,Pocket,230.55,213,37,1.07,0.0,0.0011
22842,"Biscuit Tin, Red,Ivory, Vintage",Biscuit,230.55,37,7,6.52,5.93,0.0011
90164A,Pink Rosebud Pearl Bracelet,Pink,230.39,40,25,6.93,0.0,0.0011
23446,Blue Bunny Easter Egg Basket,Blue,230.25,157,3,1.58,0.0,0.0011
37508,New England Ceramic Cake Server,New,229.57,89,46,2.61,0.0,0.0011
72781,Black Silouette Candle Plate,Black,229.5,121,15,2.05,6.25,0.0011
90122B,Jade Crystal+Glass Bracelet,Jade,228.99,46,26,5.0,0.0,0.0011
21639,Assorted Tutti Frutti Keyring,Assorted,228.64999999999998,259,15,0.96,11.76,0.0011
90199B,5 Strand Glass Necklace Amethyst,5,228.60999999999999,36,31,6.35,0.0,0.0011
90090,Pink Crystal Heart Phone Charm,Pink,227.72,263,22,1.02,10.71,0.0011
35809B,Enamel Blue Rim Tea Container,Enamel,227.54,104,33,2.57,0.0,0.0011
71028B,Silver Blue Egg T-Light Holder,Silver,227.48,494,13,1.84,0.0,0.0011
21395,Blue Spotty Beaker,Blue,227.44,112,23,2.24,3.36,0.0011
84705C,Pink Flock Photo Frame,Pink,227.33,162,8,3.93,0.0,0.0011
22899,Childrens Apron Dolly Girl,Childrens,226.81,107,17,2.22,1.17,0.0011
72750D,F.Fairy S/3 Candle/Glass,F.Fairy,226.5,110,11,2.68,0.0,0.0011
23003,Travel Card Wallet Vintage Rose,Travel,226.2,542,53,0.42,0.0,0.0011
90003D,Crystal Pair Heart Hair Slides,Crystal,226.17,60,32,3.77,5.88,0.0011
90155,Resin Necklace W Pastel Beads,Resin,226.16,30,21,7.56,0.0,0.0011
84966A,Pink Kashmiri Boxed Mirror,Pink,225.95,13,4,25.49,0.0,0.0011
90116,Fruit Salad Bag Charm,Fruit,225.51999999999998,106,63,2.33,0.0,0.0011
21369,Mirrored Wall Art Splodges,Mirrored,225.36,133,22,2.91,0.0,0.0011
TEST001,This Is A Test Product.,This,225.0,50,9,4.5,30.77,0.0011
84927E,Flowers Tile Hook,Flowers,224.31,494,29,2.09,6.25,0.0011
35597B,Blackchristmas Tree 30Cm,Blackchristmas,224.1,78,7,1.55,0.0,0.0011
90125D,Purple Bertie Glass Bead Bag Charm,Purple,223.74,136,36,2.75,0.0,0.0011
72812,Large Zinc Glass Candleholder,Large,223.23,78,22,3.41,0.0,0.0011
17084P,Dragons Blood Incense,Dragons,222.75,990,70,0.34,0.0,0.0011
47591A,Carousel Des Child'S Apron,Carousel,221.57,134,58,1.65,1.41,0.0011
17011C,Origami Lavender Incense+Flower,Origami,221.4,335,2,2.48,0.0,0.0011
21102,"Candle In Jar Collage , Vanilla",Candle,221.08,82,20,3.06,4.76,0.0011
16258B,Daisy Erasers In Bag,Daisy,221.06,1016,15,0.36,0.0,0.0011
17013B,Origami Jasmine Incense In Tube,Origami,221.03,256,3,1.71,0.0,0.0011
72807b,Set/3 Ocean Scent Candle Jewel Box,Set/3,220.94000000000003,26,19,8.49,0.0,0.0011
35833G,4 Gold Flock Christmas Balls,4,220.66,134,34,1.66,0.0,0.0011
62086A,Pink Retro Big Flower Bag,Pink,220.35,113,24,1.95,0.0,0.0011
90124C,Green Murano Twist Necklace,Green,220.20999999999998,22,16,10.03,0.0,0.0011
72225D,Vanilla Scent Cake Candle,Vanilla,219.45999999999998,962,11,0.27,0.0,0.0011
85168A,White Baroque Carriage Clock,White,218.89999999999998,22,15,9.95,0.0,0.0011
90058A,Crystal Stud Earrings Clear Display,Crystal,218.88,576,13,0.38,7.14,0.0011
48173c,Door Mat Black Flock,Door,218.58,16,12,13.67,0.0,0.0011
84509C,Dotty Placemats,Dotty,218.29000000000002,58,13,4.61,0.0,0.0011
22845,Vintage Cat Food Container,Vintage,218.14,34,5,6.46,2.22,0.0011
72801d,4 Sky Blue Dinner Candles,4,217.32999999999998,88,51,2.47,0.0,0.0011
22588,Cardholder Gingham Heart,Cardholder,216.9,102,2,2.33,0.61,0.0011
90005A,Jade Green Enamel Hair Comb,Jade,216.87,106,57,2.08,0.0,0.0011
84725,Freestyle Canvas Art Picture,Freestyle,216.49999999999997,134,29,2.12,0.0,0.0011
35793,S/3 Puppies Christmas Decorations,S/3,216.33,108,15,3.78,0.0,0.0011
23360,Set 8 Candles Vintage Doiley,Set,216.29999999999998,122,7,1.91,0.0,0.0011
37492A,Yellow Red Flower Piggy Bank,Yellow,216.07,108,11,4.27,8.33,0.0011
84807,Red Poppy Artificial Flower,Red,215.93,233,7,1.54,0.0,0.0011
90036A,Flower Garland Necklace Red,Flower,215.76000000000002,27,20,8.01,0.0,0.0011
21543,Butterfly Water Transfer Tattoos,Butterfly,215.0,284,24,1.2,0.0,0.001
22834,Mini Hand Warmer Babushka Design,Mini,214.8,108,5,2.05,1.29,0.001
84690,S/2 Beach Hut Stools,S/2,214.65,27,14,7.95,6.67,0.001
48179,Door Mat Sweet Home,Door,214.47,34,11,9.74,0.0,0.001
90123A,Pink Heart Of Glass Bracelet,Pink,214.07,36,19,5.94,0.0,0.001
51012C,"Feather Duster, Coal Black",Feather,213.75,171,27,1.25,6.67,0.001
90214A,"Letter ""A"" Bling Key Ring",Letter,213.65,213,104,1.05,0.95,0.001
90019C,Silver Black Orbit Bracelet,Silver,213.38,40,34,5.36,0.0,0.001
16201A,Pastel Pink Photo Album,Pastel,213.37,101,9,3.77,10.0,0.001
21400,Red Pudding Spoon,Red,213.07,1078,91,0.3,1.09,0.001
22880,Number Tile Vintage Font 1,Number,212.91,103,36,3.21,0.0,0.001
84805A,Cream Climbing Hydranga Art Flower,Cream,212.85,147,8,2.76,0.0,0.001
85039a,Set/4 Red Mini Rose Candle In Bowl,Set/4,212.45,64,44,3.32,0.0,0.001
84313A,Pink Tv Tray Table,Pink,212.42,38,19,6.26,0.0,0.001
