stockcode,description,category,revenue,qty_sold,orders,avg_price,cancel_rate,revenue_share
22682,French Blue Metal Door Sign 7,French,961.81,723,124,1.62,1.08,0.0047
21691,Silver Vanilla Flower Candle Pot,Silver,960.99,249,72,3.99,0.0,0.0047
85197,Set Of 12 Mini Bunnies In A Bucket,Set,959.46,1669,74,2.06,0.0,0.0047
85130D,Beaded Crystal Heart Pink Large,Beaded,958.8499999999999,788,107,1.78,0.0,0.0047
72753B,S/3 Flwr Fairy Lavender Candles,S/3,957.73,445,14,3.34,0.0,0.0047
21805,White Christmas Tree Decoration,White,957.63,2221,103,0.51,0.0,0.0047
22994,Travel Card Wallet Retrospot,Travel,956.94,2194,218,0.53,2.67,0.0047
84360,Table Lamp White Shade Wood Base,Table,956.89,179,40,6.24,0.0,0.0047
22512,Doorstop Racing Car Design,Doorstop,956.1700000000001,384,71,3.63,0.0,0.0047
23529,Wall Art Dolly Girl,Wall,956.0500000000002,319,26,4.65,0.0,0.0047
22246,Magic Garden Felt Garland,Magic,955.5899999999999,425,93,2.84,0.53,0.0047
23380,Pack Of 12 Vintage Doily Tissues,Pack,955.42,2272,119,0.49,1.6,0.0047
84664,Cherry Blossom Bathroom Cabinet,Cherry,955.35,193,51,4.95,3.77,0.0047
85111,Silver Glitter Flower Votive Holder,Silver,954.15,2907,77,0.76,1.27,0.0047
20758,Abstract Circles Pocket Book,Abstract,953.42,5425,95,0.82,1.02,0.0047
85032B,Blossom Images Gift Wrap Set,Blossom,953.34,982,152,1.27,0.0,0.0047
21711,Folding Umbrella  White/Red  Spot,Folding,953.0,262,28,4.9,0.0,0.0047
21060,Party Invites Balloon Girl,Party,952.55,1276,151,0.94,0.0,0.0047
20878,Set/9 Christmas T-Lights Scented,Set/9,952.51,737,85,1.48,0.0,0.0047
17012C,Origami Lavender Incense/Candl Set,Origami,950.4,856,113,2.02,0.0,0.0046
21129,Silver Fishing Gnome,Silver,949.44,124,60,9.01,3.23,0.0046
37492B,Blue Yellow Flower Piggy Bank,Blue,946.7199999999999,489,44,3.67,12.0,0.0046
21331,Moroccan Beaten Metal Dish Large,Moroccan,946.68,110,30,14.57,6.25,0.0046
85032C,Curious Images Gift Wrap Set,Curious,946.59,886,161,1.37,0.61,0.0046
21641,Assorted Tutti Frutti Keyring Ball,Assorted,946.31,1666,111,1.23,0.0,0.0046
22939,Adult Apron Apple Delight,Adult,945.88,184,45,6.36,1.09,0.0046
20778,Garden Path Notebook,Garden,944.3599999999999,3611,90,1.81,2.15,0.0046
22986,Wrap Gingham Rose,Wrap,943.92,2276,82,0.42,0.49,0.0046
22529,Magic Drawing Slate Go To The Fair,Magic,943.71,2341,153,0.46,0.0,0.0046
85031A,Romantic Images Scrap Book Set,Romantic,943.44,477,102,3.54,0.0,0.0046
22143,Christmas Craft Heart Decorations,Christmas,942.88,446,70,2.58,2.74,0.0046
20998,Rose Du Sud Oven Glove,Rose,942.2600000000001,324,127,2.94,0.0,0.0046
22096,Pink Paisley Square Tissue Box,Pink,938.86,1667,180,0.92,1.07,0.0046
85124B,Blue Juicy Fruit Photo Frame,Blue,938.47,353,102,2.98,0.97,0.0046
90147,Chunky Silver Necklace Pastel Flowe,Chunky,937.4499999999999,93,58,10.16,3.28,0.0046
84817,Danish Rose Decorative Plate,Danish,937.44,1059,79,1.63,8.05,0.0046
84905,Pink Butterfly Cushion Cover,Pink,937.09,259,99,4.87,0.0,0.0046
23178,Jam Clock Magnet,Jam,936.89,327,68,3.36,4.23,0.0046
85121B,Retro Laundry Tub Pink,Retro,936.74,86,48,12.07,11.11,0.0046
23540,Wall Art The Magic Forest,Wall,933.16,148,13,8.54,0.0,0.0046
85226A,White/Blue Pull Back Racing Car,White/Blue,933.07,1714,144,0.74,3.82,0.0046
47504E,English Rose Scissors,English,931.86,4387,48,1.85,0.0,0.0046
21726,Multi Hearts  Stickers,Multi,930.99,1077,155,0.97,0.63,0.0045
23179,Clock Magnet Mum'S Kitchen,Clock,930.48,324,53,3.52,0.0,0.0045
21720,Cake Shop  Sticker Sheet,Cake,929.81,1068,112,1.03,0.88,0.0045
21880,Red Retrospot Tape,Red,928.9000000000001,2000,258,0.52,0.6,0.0045
21014,Swiss Chalet Tree Decoration,Swiss,928.0899999999999,1850,189,0.81,0.51,0.0045
20831,Gold Photo Frame,Gold,927.96,474,79,2.72,1.23,0.0045
20775,Daisy Notebook,Daisy,926.54,3604,112,1.74,0.0,0.0045
84918,Cream Cushion Cover With Flowers,Cream,925.62,198,60,6.02,1.56,0.0045
23099,French Carriage Lantern,French,925.35,137,58,7.04,6.35,0.0045
23527,Animals And Nature Wall Art,Animals,923.97,267,17,3.7,4.0,0.0045
21284,Retrospot Candle  Small,Retrospot,923.97,1139,80,1.65,2.1,0.0045
82607A,Glass Bonbon Jar Parfume Aux Fleure,Glass,923.72,663,159,1.81,4.22,0.0045
84341B,Small Pink Magic Christmas Tree,Small,922.18,1757,121,0.89,0.0,0.0045
22703,Pink Cat Bowl,Pink,921.81,513,165,1.93,0.0,0.0045
22268,Easter Decoration Sitting Bunny,Easter,921.75,1074,153,1.05,2.78,0.0045
20903,Vintage Keepsake Box Travelogue,Vintage,919.8,187,86,7.18,1.15,0.0045
22647,Ceramic Love Heart Money Bank,Ceramic,919.63,1058,82,1.54,4.65,0.0045
85121C,Retro Laundry Tub Pistachio,Retro,918.91,98,53,9.96,1.85,0.0045
72529W,White Advent Candle,White,918.75,464,47,2.46,4.08,0.0045
21702,Set 5 Mini Gateaux  Fridge Magnets,Set,918.6800000000001,2636,8,1.34,0.0,0.0045
72045D,Roses On Blue Teacup Candle,Roses,918.65,539,6,2.98,14.29,0.0045
21291,Small Spotty Chocolate Gift Bag,Small,918.49,1073,77,0.94,3.16,0.0045
85130B,Beaded Crystal Heart Green Large,Beaded,918.33,911,83,1.7,0.0,0.0045
84600,New Baroque Jewellery Box,New,918.27,108,52,9.62,5.45,0.0045
21264,White Goose Feather Tree 60Cm,White,917.8499999999999,391,68,3.47,2.86,0.0045
84907,Pink Yellow Patch Cushion Cover,Pink,916.8299999999999,383,31,5.77,12.2,0.0045
23338,Egg Frying Pan Red,Egg,915.4000000000001,431,109,2.34,0.91,0.0045
22683,French Blue Metal Door Sign 8,French,915.3,673,127,1.67,1.03,0.0045
85019A,Romantic Images Notebook Set,Romantic,915.04,647,49,2.68,2.0,0.0045
21007,Etched Glass Droplet Decoration,Etched,914.67,1927,48,1.18,0.0,0.0045
23002,Travel Card Wallet Skulls,Travel,914.37,2119,192,0.52,3.96,0.0045
21320,Glass Chalice Green  Large,Glass,913.34,398,56,3.16,12.31,0.0045
79030G,"Tumbler, New England","Tumbler,",911.76,490,68,4.18,0.0,0.0045
22707,Wrap Monster Fun,Wrap,905.94,2157,83,0.42,0.0,0.0044
46000P,Polyester Filler Pad 65Cmx65Cm,Polyester,905.25,213,49,4.25,2.0,0.0044
46776C,Woven Frost Cushion Cover,Woven,905.1,258,96,4.32,0.0,0.0044
48173c,Doormat Black Flock,Doormat,904.97,54,25,16.63,0.0,0.0044
22288,"Decoration , Hanging Metal Rabbit",Decoration,904.02,834,60,1.51,0.0,0.0044
23004,Travel Card Wallet Pantry,Travel,903.16,2002,221,0.6,1.75,0.0044
21444,Blue Chalet Birdfeeder,Blue,902.0300000000001,291,36,5.46,2.7,0.0044
23532,Wall Art Work Rest And Play,Wall,901.58,210,31,5.3,0.0,0.0044
22248,Decoration  Pink Chick Magic Garden,Decoration,901.5,1013,173,1.07,1.65,0.0044
21318,Glass Chalice Blue Small,Glass,900.42,972,93,1.6,11.32,0.0044
21480,Pink Stripe Hot Water Bottle,Pink,899.5200000000001,285,57,3.84,1.69,0.0044
84660B,Black Stitched Wall Clock,Black,899.48,745,61,3.06,0.0,0.0044
84820,Danish Rose Trinket Trays,Danish,899.37,323,54,5.31,3.57,0.0044
20913,Set/5 Blue Spotty Lid Glass Bowls,Set/5,898.7199999999999,314,43,3.8,0.0,0.0044
17109B,Flower Fairy Incense Lavender,Flower,896.3399999999999,4542,17,1.32,0.0,0.0044
20941,Frog Candle,Frog,896.28,998,124,1.77,3.85,0.0044
85031B,Blossom Images Scrap Book Set,Blossom,896.09,496,85,3.38,0.0,0.0044
84760L,Large Hanging Glass+Zinc Lantern,Large,896.0,560,1,1.6,0.0,0.0044
22936,Baking Mould Rose White Chocolate,Baking,895.97,279,50,4.33,1.89,0.0044
23472,Nine Drawer Office Tidy,Nine,894.42,58,33,16.09,0.0,0.0044
21676,Flowers  Stickers,Flowers,893.7199999999999,1193,159,1.01,0.0,0.0044
85049e,Scandinavian Reds Ribbons,Scandinavian,893.25,268,61,3.3,0.0,0.0044
84666,Square Cherry Blossom Cabinet,Square,892.7,226,33,3.95,0.0,0.0044
20759,Chrysanthemum Pocket Book,Chrysanthemum,891.13,5777,63,0.77,0.0,0.0044
20757,Red Daisy Pocket Book,Red,890.7,5347,78,0.84,0.0,0.0043
17129F,Blue Glass Gems In Bag,Blue,890.12,911,81,1.39,1.35,0.0043
85194S,Hanging Spring Flower Egg Small,Hanging,889.46,1760,131,0.78,2.21,0.0043
21220,Set/4 Badges Dogs,Set/4,888.68,659,159,1.64,0.0,0.0043
22953,Birthday Party Cordon Barrier Tape,Birthday,888.55,712,116,1.38,0.0,0.0043
21724,Panda And Bunnies Sticker Sheet,Panda,888.3399999999999,996,178,1.01,0.56,0.0043
85214,Tub 24 Pink Flower Pegs,Tub,886.2299999999999,514,169,1.84,0.0,0.0043
23528,Spaceboy Wall Art,Spaceboy,885.9000000000001,306,13,3.58,0.0,0.0043
84086C,Pink/Purple Retro Radio,Pink/Purple,884.75,297,88,3.24,0.0,0.0043
20991,Jazz Hearts Magnetic Memo Pad,Jazz,884.5600000000002,7084,32,0.95,0.0,0.0043
22164,String Of Stars Card Holder,String,883.2200000000001,315,49,3.35,2.0,0.0043
23502,Playing Cards Vintage Doily,Playing,880.16,701,92,1.3,0.0,0.0043
84974,S/2 Zinc Heart Design Planters,S/2,879.55,89,57,9.93,1.69,0.0043
72799A,Black Pillar Candle Silver Flock,Black,877.8000000000001,612,18,2.46,0.0,0.0043
23423,Pantry 3 Hook Rolling Pin Hanger,Pantry,876.9,219,66,4.54,4.35,0.0043
21185,Home Sweet Home  Blackboard,Home,876.29,132,44,7.37,6.38,0.0043
21062,Party Invites Spaceman,Party,875.87,1053,136,0.87,0.0,0.0043
35598B,Black Christmas Tree 60Cm,Black,874.65,931,57,2.55,0.0,0.0043
90200C,Blue Sweetheart Bracelet,Blue,874.63,206,98,4.24,1.98,0.0043
20803,Small Pink Glass Sundae Dish,Small,874.4599999999999,1149,84,1.7,3.45,0.0043
21270,Antique Cream Cutlery Cupboard,Antique,874.43,76,51,12.02,0.0,0.0043
22896,Peg Bag Apple Design,Peg,874.35,387,29,2.49,0.54,0.0043
90200E,Green Sweetheart Bracelet,Green,873.97,209,91,4.22,5.21,0.0043
21338,Marakesh Lantern Small,Marakesh,873.25,199,13,6.31,0.0,0.0043
84925F,Psychedelic Wall Thermometer,Psychedelic,873.11,714,34,2.24,0.0,0.0043
85165,Candy Pink French Boudoir Clock,Candy,872.76,90,58,10.22,0.0,0.0043
23479,Wire Egg Basket,Wire,872.38,113,44,8.27,0.0,0.0043
21293,Mirrored Dove Wall Decoration,Mirrored,872.34,343,85,3.01,1.15,0.0043
21414,Scallop Shell Soap Dish,Scallop,870.89,1637,36,2.92,2.63,0.0043
21147,Jingle Bells Tree Decoration,Jingle,870.48,477,118,2.12,0.83,0.0043
21392,Red Spotty Pudding Bowl,Red,869.23,3828,31,2.5,3.92,0.0042
23220,Reindeer Heart Decoration Gold,Reindeer,869.1500000000001,993,103,1.08,0.95,0.0042
84826,Asstd Design 3D Paper Stickers,Asstd,869.08,1734,51,0.66,3.64,0.0042
17033,"Brocade Purse,Small Arch Button",Brocade,867.8399999999999,3280,69,0.29,1.43,0.0042
22322,Bird Decoration Green Polkadot,Bird,867.5899999999999,939,164,1.18,1.09,0.0042
17012B,Origami Jasmine Incense/Candle Set,Origami,867.4499999999999,721,126,2.19,0.0,0.0042
20658,Red Retrospot Luggage Tag,Red,866.06,584,158,1.68,0.83,0.0042
23545,Wrap Red Vintage Doily,Wrap,866.0,2100,68,0.42,0.0,0.0042
21398,Red Polkadot Coffee  Mug,Red,864.11,1585,73,1.54,0.79,0.0042
85166B,Black Metal Baroque Photo Frame,Black,864.1,510,38,3.85,0.0,0.0042
85161,Acrylic Geometric Lamp,Acrylic,863.85,51,32,18.25,5.71,0.0042
21255,"French Bottle , Lavender",French,860.0799999999999,476,96,2.39,2.04,0.0042
84632,Decorative Hanging Shelving Unit,Decorative,859.25,15,11,59.04,8.33,0.0042
22486,Plasmatronic Lamp,Plasmatronic,856.4,104,40,9.82,14.89,0.0042
84660A,White Stitched Wall Clock,White,855.26,860,51,2.21,3.77,0.0042
21635,Madras Notebook Large,Madras,855.24,398,42,3.29,2.27,0.0042
84578,Elephant Toy With Blue T-Shirt,Elephant,854.91,222,112,3.87,0.0,0.0042
21478,Silver Skull Hot Water Bottle,Silver,854.23,204,92,4.42,1.06,0.0042
23525,Buffalo Bill Wall Art,Buffalo,852.72,248,16,3.69,1.85,0.0042
20756,Green Fern Pocket Book,Green,851.5600000000001,5728,64,0.81,0.0,0.0042
35954,Small Folkart Star Christmas Dec,Small,850.49,2181,111,1.22,0.0,0.0042
21376,Large  Tall Camphor Wood Toadstool,Large,849.91,183,46,6.0,0.0,0.0042
21458,2 Picture Book Eggs Easter Bunny,2,849.24,768,88,1.64,0.0,0.0041
20897,Vintage Notebook Paris Days,Vintage,848.7,351,75,3.85,2.6,0.0041
72349b,Set/6 Purple Butterfly T-Lights,Set/6,848.41,204,112,4.17,0.0,0.0041
22547,Mini Jigsaw Dinosaur,Mini,846.82,1980,189,0.59,0.52,0.0041
22229,Bunny Wooden Painted With Flower,Bunny,845.3,1007,185,1.02,3.57,0.0041
22820,Gift Bag Birthday,Gift,845.13,1353,110,0.64,0.89,0.0041
90161C,Ant Copper Lime Boudicca Bracelet,Ant,843.91,169,100,5.02,0.0,0.0041
37423,White With Black Cats Plate,White,843.88,6168,70,1.33,1.41,0.0041
20936,Forked Cactus Candle,Forked,843.3900000000001,333,76,3.67,3.8,0.0041
21300,Antique Edwardian Dresser,Antique,841.7,53,12,23.48,14.29,0.0041
21128,Gold Fishing Gnome,Gold,841.63,126,57,9.54,0.0,0.0041
23564,Egg Cup Milkmaid Ingrid,Egg,841.31,644,76,1.76,0.0,0.0041
84782A,Pink 3 Tier Glass Plate Stand,Pink,840.45,119,26,9.9,18.75,0.0041
23551,Pack Of 12 Paisley Park Tissues,Pack,839.8399999999999,1840,136,0.52,0.0,0.0041
85231L,Lavender Scented Set/9 T-Lights,Lavender,838.3499999999999,1039,116,0.91,0.0,0.0041
17039,Inlaid Wood Incense Holder,Inlaid,837.88,3707,43,0.38,0.0,0.0041
84762B,Pink Picnic Barbecue Bucket,Pink,837.77,113,48,8.78,0.0,0.0041
21552,Ceramic Birdhouse Black Rose  Large,Ceramic,837.6,165,35,6.26,5.26,0.0041
84997a,Childrens Cutlery Polkadot Green,Childrens,837.29,101,60,8.29,0.0,0.0041
85071C,"Charlie+Lola""Extremely Busy"" Sign","Charlie+Lola""Extremely",837.23,1285,141,1.68,0.0,0.0041
40018E,Tea Time Paper Lanterns,Tea,837.02,384,81,2.85,0.0,0.0041
85208,Set/12 Funky Felt Flower Peg In Bag,Set/12,836.94,420,87,2.15,0.0,0.0041
47563A,Retro Longboard Ironing Board Cover,Retro,836.62,343,151,3.34,0.66,0.0041
47367B,Pair Padded Hangers Pink Check,Pair,834.95,242,95,3.53,1.03,0.0041
22785,Squarecushion Cover Pink Union Flag,Squarecushion,833.8199999999999,119,52,7.38,0.0,0.0041
21286,Retrospot Candle  Large,Retrospot,833.75,711,52,2.34,0.98,0.0041
84849A,Hello Sailor Blue Soap Holder,Hello,833.57,470,103,2.23,2.8,0.0041
23523,Treasure Ahoy Wall Art,Treasure,833.46,270,16,3.58,2.38,0.0041
20776,Abstract Circles Notebook,Abstract,832.66,3258,84,1.78,0.0,0.0041
85196,Easter Bunnies On A Stick,Easter,831.04,1564,71,0.88,1.39,0.0041
84509a,Set Of 4 English Rose Placemats,Set,829.18,111,74,7.47,0.0,0.004
85213,Mini  Zinc Garden Decorations,Mini,828.9999999999999,1378,80,1.05,1.23,0.004
20894,Hanging Bauble T-Light Holder Large,Hanging,827.3000000000001,267,79,3.45,3.61,0.004
23017,Apothecary Measuring Jar,Apothecary,826.28,67,22,12.76,4.35,0.004
85188A,Green Metal Swinging Bunny,Green,824.9699999999999,944,105,1.02,1.87,0.004
21551,Ceramic Birdhouse Butterfly Large,Ceramic,824.95,169,22,6.8,0.0,0.004
79342B,Brown Flower Lights,Brown,824.9499999999999,119,34,8.73,10.53,0.004
21654,Ridged Glass Finger Bowl,Ridged,820.2099999999999,1183,82,1.28,0.0,0.004
82613C,"Metal Sign,Cupcake Single Hook",Metal,820.01,770,187,1.74,1.06,0.004
23186,French Style Storage Jar Cafe,French,819.4599999999999,1982,70,0.34,2.74,0.004
22685,French Blue Metal Door Sign 0,French,818.33,621,106,1.56,0.62,0.004
21375,Large Camphor Wood Field Mushroom,Large,817.6,134,61,8.06,0.0,0.004
85187,S/12 Mini Rabbit Easter,S/12,816.4799999999999,479,109,1.95,0.0,0.004
21719,Lovely Bonbon Sticker Sheet,Lovely,813.14,906,141,1.07,0.0,0.004
20833,Shaker Throw  Quilted,Shaker,811.8,52,5,27.63,16.67,0.004
21374,Mirrored Wall Art Skulls,Mirrored,809.67,470,71,2.9,0.0,0.004
85145,Jardin Etched Glass Large Bell Jar,Jardin,809.05,91,30,9.4,3.23,0.004
20769,Daisy Journal,Daisy,808.8100000000001,438,79,2.56,0.0,0.0039
47594B,Scotties Design Washbag,Scotties,808.39,408,122,2.15,9.63,0.0039
84922,Pink Butterfly Washbag,Pink,808.22,342,17,5.87,0.0,0.0039
23022,Small Bonne Jam Jar  T-Light Holder,Small,808.16,422,22,2.03,7.69,0.0039
21454,Painted Pink Rabbit,Painted,807.5999999999999,937,194,0.91,0.51,0.0039
20901,Vintage Keepsake Box Pink Flower,Vintage,806.58,91,67,9.47,1.47,0.0039
84767,Zinc Police Box Lantern,Zinc,806.22,195,6,7.4,0.0,0.0039
17012A,Origami Vanilla Incense/Candle Set,Origami,806.16,726,95,2.23,0.0,0.0039
84920,Pink Flower Fabric Pony,Pink,805.38,201,88,4.45,0.0,0.0039
37333,"Retro ""Tea For One""",Retro,805.1,145,58,6.92,0.0,0.0039
21222,Set/4 Badges Beetles,Set/4,804.65,621,133,1.52,0.0,0.0039
23409,Photo Frame Linen And Lace Large,Photo,801.68,215,43,3.81,4.44,0.0039
85044,Red Reindeer String Of 20 Lights,Red,801.4,149,40,6.93,11.11,0.0039
16011,Animal Stickers,Animal,799.3199999999999,3812,112,0.21,0.88,0.0039
22825,Decorative Plant Pot With Frieze,Decorative,799.02,100,38,8.34,9.52,0.0039
20699,Mousey Long Legs Soft Toy,Mousey,797.96,294,88,3.06,0.0,0.0039
23524,Horse & Pony Wall Art,Horse,797.3100000000001,256,17,3.59,1.56,0.0039
21455,Painted Yellow Wooden Daisy,Painted,797.27,901,167,0.94,1.16,0.0039
20997,Rose Du Sud Cushion Cover,Rose,796.74,170,83,4.72,0.0,0.0039
21285,Retrospot Candle  Medium,Retrospot,796.4000000000001,744,63,2.01,2.94,0.0039
21558,Skull Lunchbox With Cutlery,Skull,796.12,298,65,3.27,1.15,0.0039
22058,Ceramic Love Hearts Design Mug,Ceramic,795.72,520,103,1.66,2.65,0.0039
23487,Sweet Heart Cake Carrier,Sweet,795.5799999999999,80,44,10.37,12.0,0.0039
17129F,Deep Blue Glass Gems In Bag,Deep,794.4599999999999,669,64,1.42,1.35,0.0039
37494A,Fairy Cake Ceramic Butter Dish,Fairy,793.44,237,51,4.48,5.56,0.0039
84625D,White Newbaroque Candlestick Candle,White,793.34,650,51,2.33,7.14,0.0039
35915C,Peach Knitted Hen,Peach,793.3199999999999,662,82,1.35,0.0,0.0039
47574A,English Rose Scented Hanging Flower,English,792.73,573,129,2.3,0.76,0.0039
23106,Zinc Hearts Plant Pot Holder,Zinc,792.47,283,52,2.94,1.85,0.0039
23519,Embroidered Ribbon Reel Claire,Embroidered,792.31,224,24,4.48,0.0,0.0039
85017A,Envelope 50 Romantic Images,Envelope,792.15,1157,174,0.83,0.0,0.0039
45008C,Decorative Net Canopy Cream,Decorative,792.0699999999999,83,34,12.16,0.0,0.0039
22785,Cushion Cover Pink Union Flag,Cushion,792.0600000000001,120,28,7.45,0.0,0.0039
23335,Egg Frying Pan Ivory,Egg,790.7800000000001,377,96,2.33,2.02,0.0039
37330,Spots Mug,Spots,790.6999999999999,437,21,2.3,9.68,0.0039
21286,Retro Spot Candle  Large,Retro,789.26,295,49,3.52,0.98,0.0039
23568,Egg Cup Henrietta Hen Cream,Egg,787.52,630,48,1.75,2.04,0.0038
84970s,Hanging Heart Zinc T-Light Holder,Hanging,784.04,373,98,2.1,0.0,0.0038
22414,Door Mat Neighbourhood Witch,Door,783.87,95,51,9.33,0.9,0.0038
22408,Money Box Confectionery Design,Money,783.67,638,94,1.47,2.04,0.0038
72799C,Pink Pillar Candle Silver Flock,Pink,783.1,471,48,3.07,0.0,0.0038
20989,Urban Chic Chopsticks Set/5,Urban,782.18,407,57,2.27,1.72,0.0038
22204,Milk Pan Blue Polkadot,Milk,782.16,226,92,3.75,2.86,0.0038
84247E,Pack/12 Xmas Fun Card,Pack/12,780.2600000000001,270,59,2.99,7.69,0.0038
37461,Funky Monkey Mug,Funky,778.64,742,95,1.61,1.03,0.0038
21456,2 Picture Book Eggs Easter Chicks,2,776.05,738,65,1.45,1.49,0.0038
90200B,Black Sweetheart Bracelet,Black,775.45,183,84,4.23,2.33,0.0038
84534B,Fairy Cake Notebook A5 Size,Fairy,774.7099999999999,818,187,1.2,1.58,0.0038
21015,Dark Bird House Tree Decoration,Dark,771.7299999999999,1700,186,0.77,0.53,0.0038
23115,Red Apples Chopping Board,Red,770.32,152,45,5.84,0.0,0.0038
22684,French Blue Metal Door Sign 9,French,769.86,562,108,1.71,1.79,0.0038
21723,Alphabet Hearts Sticker Sheet,Alphabet,769.13,866,135,1.03,0.0,0.0038
20910,Vintage Photo Album Paris Days,Vintage,769.12,106,47,8.38,0.0,0.0038
22985,Wrap Billboard Fonts Design,Wrap,769.02,1831,64,0.42,0.0,0.0038
84761,Ivory Hanging Bird Planter,Ivory,768.85,276,61,3.12,1.61,0.0038
21554,Ceramic Birdhouse Red Roof Large,Ceramic,767.75,167,22,6.48,8.33,0.0037
84712B,Pink Jewelled Photo Frame,Pink,767.1600000000001,98,60,7.8,0.0,0.0037
72755C,Flower Fairy Oil Burner Set Rose,Flower,767.0,592,14,1.89,6.67,0.0037
35095B,Red Victorian Fabric Oval Box,Red,766.64,1952,177,0.62,0.0,0.0037
84029C,Brown Furry Hot Water Bottle,Brown,766.19,204,48,4.56,0.0,0.0037
23140,Triple Wire Hook Ivory Heart,Triple,766.1,182,52,4.54,1.89,0.0037
16259,Piece Of Camo Stationery Set,Piece,766.09,5473,55,0.15,6.78,0.0037
22640,Set Of 4 Napkin Charms 3 Keys,Set,765.39,357,87,2.56,0.0,0.0037
16244B,Maxwell 2 Tone Blue 60 Page Photo A,Maxwell,765.02,345,28,3.87,0.0,0.0037
84963A,Pink Painted Kashmiri Chair,Pink,763.35,23,9,41.74,0.0,0.0037
23550,Wrap Alphabet Poster,Wrap,763.1,1855,64,0.42,0.0,0.0037
35811A,Enamel Pink Sugar Container,Enamel,762.97,434,84,2.91,1.18,0.0037
23006,Travel Card Wallet Flower Meadow,Travel,762.75,1758,173,0.52,2.81,0.0037
23458,Dolly Cabinet 3 Drawers,Dolly,762.4499999999999,51,30,14.95,11.76,0.0037
22492,Mini Paint Set Vintage  Boy+ Girl,Mini,761.4,1260,18,0.64,1.88,0.0037
84762C,Green Picnic Barbecue Bucket,Green,761.25,105,43,8.56,0.0,0.0037
21709,Folding Umbrella Chocolate Polkadot,Folding,760.95,163,68,4.78,0.0,0.0037
23025,Drawer Knob Vintage Glass Ball,Drawer,760.8000000000001,350,54,2.27,1.82,0.0037
23524,Wall Art Horse & Pony,Wall,760.32,225,46,4.59,1.56,0.0037
23123,Cocktail Swords 50 Pieces,Cocktail,759.57,935,95,1.01,2.06,0.0037
21298,Edwardian 2 Drawer Wall Cabinet,Edwardian,755.8,52,14,19.38,26.32,0.0037
85135A,Yellow Dragonfly Helicopter,Yellow,754.59,94,63,8.03,5.97,0.0037
90209C,Pink Enamel+Glass Hair Comb,Pink,754.46,399,66,2.08,2.94,0.0037
47581B,Fairy Cake Wicker Picnic Basket,Fairy,753.77,46,36,16.32,2.7,0.0037
22124,Set Of 2 Tea Towels Ping Microwave,Set,751.9300000000001,298,132,2.72,0.0,0.0037
17165B,Ass Col Large Sand Gecko P'Weight,Ass,751.68,810,57,1.03,3.17,0.0037
21194,Pink  Honeycomb Paper Fan,Pink,751.5,578,95,2.03,3.0,0.0037
23124,18Pc Wooden Cutlery Set Disposable,18Pc,751.38,567,43,1.75,0.0,0.0037
84653,Green Rose Quilt,Green,750.48,14,12,54.88,0.0,0.0037
23223,Christmas Tree Hanging Silver,Christmas,750.19,801,88,1.09,1.11,0.0037
21344,Moroccan Beaten Metal Dish,Moroccan,749.82,166,26,8.92,7.14,0.0037
90200A,Purple Sweetheart Bracelet,Purple,749.69,177,99,4.23,1.98,0.0037
84615,Pink Round Butterfly Mirror,Pink,748.48,240,21,5.61,4.55,0.0037
35647,Vintage Bead Pink Shade,Vintage,748.24,563,74,1.77,0.0,0.0037
84620,Blue Gingham Rose Cushion Cover,Blue,746.61,121,50,6.54,0.0,0.0036
84663A,Grass Hopper Wooden Wall Clock,Grass,746.39,373,64,4.42,5.88,0.0036
21284,Retro Spot Candle  Small,Retro,744.75,408,60,2.38,2.1,0.0036
84842,Hello Sailor Bathroom Set,Hello,744.15,1505,35,4.43,2.78,0.0036
21319,Glass Chalice Green  Small,Glass,743.61,508,65,1.97,5.8,0.0036
72800A,S/4 Black Dinner Candle Silver Floc,S/4,743.26,674,46,2.98,0.0,0.0036
23282,Folding Butterfly Mirror Ivory,Folding,742.9200000000001,794,133,1.26,0.0,0.0036
84689,S/2 Beach Hut Treasure Chests,S/2,742.9,312,40,5.3,9.09,0.0036
22676,"French Blue Metal Door Sign, 1",French,742.67,577,79,1.44,0.65,0.0036
21377,Small Camphor Wood Field  Mushroom,Small,742.56,518,98,2.52,1.01,0.0036
84821,Danish Rose Deluxe Coaster,Danish,742.5,1318,74,0.8,1.32,0.0036
21391,French Emroidr Lavender Scent Heart,French,741.6,341,67,2.44,0.56,0.0036
21503,Toybox  Wrap,Toybox,740.42,1801,64,0.42,1.54,0.0036
23114,Vintage Leaf Chopping Board,Vintage,737.95,149,45,5.45,4.26,0.0036
85130C,Beaded Crystal Heart Blue  Large,Beaded,737.89,659,68,1.36,0.0,0.0036
84033,Flag Of St George,Flag,735.38,392,49,3.42,3.85,0.0036
22638,Set Of 4 Napkin Charms Crowns,Set,735.23,405,74,2.35,1.33,0.0036
84715,Set Of 6 Ice Cream Skittles,Set,734.8900000000001,241,47,3.39,0.0,0.0036
90161B,Ant Copper Turq Boudicca Bracelet,Ant,734.16,147,76,5.02,0.0,0.0036
84708B,Pink Jewelled Photo Frame,Pink,732.7900000000001,142,53,5.39,0.0,0.0036
23435,3 Raffia Ribbons Vintage Christmas,3,732.4200000000001,824,99,0.9,0.0,0.0036
ADJUST2,Adjustment By Peter On Jun 25 2010,Adjustment,731.0500000000001,3,3,243.68,0.0,0.0036
85131B,Beaded Crystal Heart Green On Stick,Beaded,730.74,948,216,0.86,0.0,0.0036
90209B,Green Enamel+Glass Hair Comb,Green,730.66,380,97,2.09,0.0,0.0036
47503F,Ass Floral Print Torch,Ass,729.9499999999999,2567,11,1.52,8.33,0.0036
21378,Small Tall Camphor Wood Toadstool,Small,728.97,560,88,2.16,0.0,0.0036
72800B,S/4 Purple Dinner Candle Blk Flock,S/4,728.6700000000001,650,34,2.82,1.05,0.0036
21443,Olive Chalet Birdfeeder,Olive,727.9300000000001,257,26,4.63,3.7,0.0036
20657,Tropical Luggage Tag,Tropical,726.47,1877,118,1.32,0.0,0.0035
21415,Clam Shell Small,Clam,726.16,348,82,2.65,0.0,0.0035
85230F,Jasmine Votive Candle,Jasmine,725.6999999999999,2946,62,0.28,0.0,0.0035
35095A,Blue Victorian Fabric Oval Box,Blue,725.5600000000001,1809,166,0.64,0.0,0.0035
23562,Set Of 6 Ribbons Perfectly Pretty,Set,724.59,251,43,3.29,0.0,0.0035
85088,Candy Spot Hand Bag,Candy,723.85,347,78,2.34,2.47,0.0035
84595E,Large Tortilla Design Red Bowl,Large,723.5699999999999,367,43,3.28,2.27,0.0035
21393,Blue  Spotty Pudding Bowl,Blue,723.5500000000001,2679,28,2.33,4.35,0.0035
84971L,Large Heart Flowers Hook,Large,723.51,585,58,1.57,3.28,0.0035
84976,Rectangular Shaped Mirror,Rectangular,722.76,674,56,1.69,3.45,0.0035
20701,Pink Cat Floral Cushion Cover,Pink,721.49,353,50,4.42,0.0,0.0035
10134,Colouring Pencils Brown Tube,Colouring,721.13,625,52,1.29,1.82,0.0035
84684,Beach Hut Photo Frame,Beach,720.6999999999999,609,40,3.29,4.76,0.0035
85017C,Envelope 50 Curious Images,Envelope,719.67,1087,119,0.81,0.82,0.0035
23222,Christmas Tree Hanging Gold,Christmas,718.53,799,75,1.05,2.53,0.0035
35951,Folkart Bauble Christmas Decoration,Folkart,717.99,1352,46,1.19,0.0,0.0035
21001,Rose Du Sud Washbag,Rose,717.8000000000001,141,90,4.9,0.0,0.0035
84997d,Pink 3 Piece Polkadot Cutlery Set,Pink,717.4300000000001,85,16,8.41,0.0,0.0035
84997c,Blue 3 Piece Polkadot Cutlery Set,Blue,717.25,85,17,8.43,0.0,0.0035
21026,Space Owl,Space,716.73,549,124,1.63,0.0,0.0035
21457,2 Picture Book Eggs Easter Ducks,2,716.0,685,65,1.54,0.0,0.0035
21076,Set/20 Collage Paper Napkin,Set/20,714.55,843,92,0.98,1.05,0.0035
20850,Zinc Heart Lattice Planter Bowl,Zinc,713.8000000000001,820,23,2.84,0.0,0.0035
35915B,Blue Knitted Hen,Blue,713.73,563,67,1.21,0.0,0.0035
21133,Painted Bird Assorted Christmas,Painted,712.9100000000001,410,42,2.17,0.0,0.0035
23042,Paper Lantern 7 Point Snow Star,Paper,711.51,103,28,7.36,3.45,0.0035
16015,Medium Chinese Style Scissor,Medium,711.38,1572,65,0.49,0.0,0.0035
20854,Blue Patch Purse Pink Heart,Blue,711.37,441,107,1.66,1.82,0.0035
21221,Set/4 Badges Cute Creatures,Set/4,709.66,535,107,1.5,0.0,0.0035
23070,Edwardian Heart Photo Frame,Edwardian,709.5400000000001,160,44,5.09,0.0,0.0035
22100,Skulls Square Tissue Box,Skulls,709.5,1005,127,1.46,0.0,0.0035
21365,Mirrored Wall Art Stars,Mirrored,707.9200000000001,469,77,2.5,0.0,0.0035
21308,Louvre Vanity Mirror,Louvre,705.9,132,6,12.16,14.29,0.0034
21265,Pink Goose Feather Tree 60Cm,Pink,705.59,321,34,3.59,8.11,0.0034
